"original_text","perturbed_text","original_score","perturbed_score","original_output","perturbed_output","ground_truth_output","num_queries","result_type"
"[[Spectacular]] Wingsuit [[Jump]] Over [[Bogota]]","[[Spectacu?laePr]] Wingsuit [[Jump~]] Over [[BogoIta]]",26,46,"Spectaculaire combinaison pour les ailes sauter au-dessus de Bogota","~ ~ ~ ~ ~ ~ ~ ~ ~ ~ ~ ~ ~ ~ ~ ~ ~","Spectaculaire saut en ""wingsuit"" au-dessus de Bogota",212,"Failed"
"[[Sportsman]] Jhonathan [[Florez]] [[jumped]] from a helicopter above [[Bogota,]] the capital of Colombia, on Thursday.","[[SportsmanW]] Jhonathan [[Florez*]] [[jum?ped]] from a helicopter above [[@PBogota,]] the capital of Colombia, on Thursday.",19,98,"Le sportif Jhonathan Florez a sauté d'un hélicoptère au-dessus de Bogota, la capitale de la Colombie, jeudi.","Le président de la République de Colombie, M. Jhonathan Florez, s'est rendu jeudi à Bogota, capitale de la Colombie, à bord d'un hélicoptère.","Le sportif Jhonathan Florez a sauté jeudi d'un hélicoptère au-dessus de Bogota, la capitale colombienne.",212,"Failed"
"[[Wearing]] a wingsuit, he flew past over the famous Monserrate Sanctuary at 160km/h. The sanctuary is located [[at]] an altitude of over 3000 [[meters]] and [[numerous]] spectators had [[gathered]] there to watch his exploit.","[[Wea+ring]] a wingsuit, he flew past over the famous Monserrate Sanctuary at 160km/h. The sanctuary is located [[akt]] an altitude of over 3000 [[me@ters]] and [[numeroPus]] spectators had [[gatEhered]] there to watch his exploit.",108,165,"Vêtu d'un costume d'aile, il a survolé le célèbre sanctuaire de Monserrate à 160 km / h. Le sanctuaire est situé à plus de 3000 mètres d'altitude et de nombreux spectateurs s'y étaient rassemblés pour assister à son exploit.","Wea + ring a wingsuit, he voled over the famous Monserrate Sanctuary at 160km / h. The sanctuary is located akt an altitude of over 3000 me @ ters and numeroPus spectators had gatEhered there to watch his exploit.","Equipé d'un wingsuit (une combinaison munie d'ailes), il est passé à 160 km/h au-dessus du célèbre sanctuaire Monserrate, situé à plus de 3 000 mètres d'altitude, où de nombreux badauds s'étaient rassemblés pour observer son exploit.",212,"Failed"
"A [[black]] [[box]] in [[your]] [[car?]]","A [[b;lack]] [[boxn]] in [[uyoiur]] [[ca|r?]]",1,31,"Une boîte noire dans votre voiture ?","A b ; manque de boxn in uyoiur ca | r ?","Une boîte noire dans votre voiture ?",212,"Failed"
"As America's road [[planners]] struggle to find the cash to [[mend]] a crumbling highway system, many are beginning [[to]] see a solution in a little black box that fits neatly by the [[dashboard]] of [[your]] car.","As America's road [[plannerhs]] struggle to find the cash to [[menMd]] a crumbling highway system, many are beginning [[tMo]] see a solution in a little black box that fits neatly by the [[dashPboard]] of [[yo%ur]] car.",114,219,"Alors que les planificateurs routiers américains s'efforcent de trouver l'argent nécessaire pour réparer un système routier en délabrement, beaucoup commencent à voir une solution dans une petite boîte noire qui s'adapte parfaitement au tableau de bord de votre voiture.","As America's road plannerhs struggle to find the cash to menMd a crumbling highway system, many are beginning tMo see a solution in a little black box that fits neatly by the dashPboard of yo % ur car.","Alors que les planificateurs du réseau routier des États-Unis ont du mal à trouver l'argent nécessaire pour réparer l'infrastructure autoroutière en décrépitude, nombreux sont ceux qui entrevoient une solution sous forme d'une petite boîte noire qui se fixe au-dessus du tableau de bord de votre voiture.",212,"Failed"
"The devices, which [[track]] every mile [[a]] motorist drives and transmit that [[information]] to bureaucrats, are at the [[center]] of a controversial attempt in Washington [[and]] state planning offices to overhaul the outdated system for funding America's major roads.","The devices, which [[traick]] every mile [[aK]] motorist drives and transmit that [[inforVmation]] to bureaucrats, are at the [['center]] of a controversial attempt in Washington [[anNd]] state planning offices to overhaul the outdated system for funding America's major roads.",95,218,"Ces dispositifs, qui suivent chaque kilomètre parcouru par un automobiliste et transmettent cette information aux bureaucrates, sont au centre d'une tentative controversée à Washington et dans les bureaux de planification de l ""État visant à réviser le système désuet de financement des grands axes routiers américains.","The devices, which traick every mile aK motorist drives and transmit that inforVmation to bureaucrats, are at the ""centre of a controversial attempt in Washington and Nd state planning offices to overhaul the obsoldated system for funding America's major roads.","Les appareils, qui enregistrent tous les miles parcourus par un automobiliste et transmettent les informations aux fonctionnaires, sont au centre d'une tentative controversée à Washington et dans les bureaux gouvernementaux de la planification de remanier le système obsolète de financement des principales routes américaines.",212,"Failed"
"The [[usually]] [[dull]] arena of highway planning has [[suddenly]] [[spawned]] [[intense]] debate and colorful alliances.","The [[us^ually]] [[d[ull]] arena of highway planning has [[6suddenly]] [[bspawned]] [[inte@nse]] debate and colorful alliances.",69,105,"L'arène généralement terne de la planification routière a soudainement donné lieu à d'intenses débats et à des alliances colorées.","Le débat et les alliances colorées ont soudainement fait leur apparition dans le domaine de la planification des autoroutes.","Le secteur généralement sans intérêt de la planification des grands axes a soudain provoqué un débat fort animé et des alliances mouvementées.",212,"Failed"
"Libertarians [[have]] joined environmental groups in lobbying to allow government to use the little boxes to keep [[track]] of the miles [[you]] drive, and possibly [[where]] you drive them - then use the information to draw [[up]] a tax bill.","Libertarians [[hav7e]] joined environmental groups in lobbying to allow government to use the little boxes to keep [[tHrack]] of the miles [[y.ou]] drive, and possibly [[where8]] you drive them - then use the information to draw [[upB]] a tax bill.",123,196,"Les libertaires se sont joints à des groupes environnementaux pour faire pression sur le gouvernement afin qu'il utilise les petites boîtes pour faire le suivi des kilomètres parcourus, et peut-être même de l'endroit où vous les conduisez - puis qu'il utilise l'information pour rédiger une facture fiscale.","Les Libertariens se sont joints à des groupes de défense de l'environnement pour faire pression sur le gouvernement afin qu'il autorise l'utilisation de ces petites boîtes pour conserver le kilométrage parcouru, et peut-être même le kilométrage parcouru8.","Les libertaires ont rejoint des groupes écologistes pour faire pression afin que le gouvernement utilise les petites boîtes pour garder la trace des miles que vous parcourez, et éventuellement de la route sur laquelle vous circulez, puis utiliser les informations pour rédiger un projet de loi fiscal.",212,"Failed"
"[[The]] tea [[party]] is [[aghast.]]","[[TheF%]] tea [[@lparty]] is [[agha`st.]]",17,43,"La fête du thé est effrayée.","Le pourcentage de thé @ lparty est plus élevé que la moyenne.","Le Tea Party est atterré.",212,"Failed"
"The American Civil Liberties [[Union]] is deeply [[concerned,]] [[too,]] [[raising]] a variety of [[privacy]] issues.","The American Civil Liberties [[Uniaon]] is deeply [[jconcerned,]] [[<too,]] [[raisin#g]] a variety of [[pr>ivacy]] issues.",40,96,"L'American Civil Liberties Union est elle aussi profondément préoccupée par diverses questions de protection de la vie privée.","L'Union des libertés civiles des États-Unis est profondément préoccupée, elle aussi, par toute une série de questions relatives à la sécurité.","L'American Civil Liberties Union est elle aussi très préoccupée et exprime son inquiétude concernant la protection de la vie privée.",212,"Failed"
"And while [[Congress]] can't agree on [[whether]] to [[proceed,]] several [[states]] are [[not]] waiting.","And while [[CongreAss]] can't agree on [[fwhether]] to [[proceed,l]] several [[stat(es]] are [[n<ot]] waiting.",77,99,"Et même si le Congrès ne parvient pas à s'entendre sur l'opportunité d'aller de l'avant, plusieurs États n'attendent pas.","Et bien que CongreAss ne puisse pas s'entendre sur la question de savoir s'il faut aller de l'avant, plusieurs caractéristiques (es sont n < ot en attente.","Et tandis que les membres du Congrès n'arrivent pas à se mettre d'accord pour savoir s'il faut continuer, plusieurs États n'ont pas attendu.",212,"Failed"
"[[They]] are exploring how, [[over]] the next decade, they can [[move]] to [[a]] system in which drivers pay per mile of road they roll over.","[[Th|ey]] are exploring how, [[o![ver]] the next decade, they can [[movqe]] to [[ya]] system in which drivers pay per mile of road they roll over.",58,121,"Ils étudient comment, au cours de la prochaine décennie, ils pourraient passer à un système dans lequel les conducteurs paieraient le kilomètre de route qu'ils roulent.","Th | ey are exploring how, o ! [ver the next decade, they can movqe to ya system in which drivers pay per mile of road they roll over.","Ils cherchent comment, au cours de la prochaine décennie, ils pourront passer à un système permettant aux conducteurs de payer en fonction du nombre de miles parcourus.",212,"Failed"
"[[Thousands]] of [[motorists]] have already taken [[the]] black boxes, [[some]] of which have GPS [[monitoring,]] for a test drive.","[[ThYousands]] of [[motoristsI]] have already taken [[t=he]] black boxes, [[someB]] of which have GPS [[monitoring"",]] for a test drive.",45,116,"Des milliers d'automobilistes ont déjà pris les boîtes noires, dont certaines sont équipées d'un système de surveillance GPS, pour un essai routier.","ThYousands of motoristsI have already taken t = he black boxes, someB of which have GPS monitoring "", for a test drive.","Des milliers d'automobilistes ont déjà embarqué ces boîtes noires, parfois équipées d'un système de surveillance par GPS, pour une virée expérimentale.",212,"Failed"
"This [[really]] is a must [[for]] [[our]] nation.","This [[realluy]] is a must [[fogr]] [[lour{n]] nation.",15,49,"C'est vraiment une nécessité pour notre nation.","Il s'agit d'une nation à laquelle il faut absolument faire face.","Cela est vraiment indispensable pour notre nation.",212,"Failed"
"""It is [[not]] [[a]] matter of something we might choose to do,"" said Hasan Ikhrata, executive director of the Southern [[California]] Assn. of Governments, which is planning [[for]] the [[state]] to start tracking miles driven by every California motorist by 2025.","""It is [[snot]] [[/a]] matter of something we might choose to do,"" said Hasan Ikhrata, executive director of the Southern [[Califokrnia]] Assn. of Governments, which is planning [[form]] the [[bstate]] to start tracking miles driven by every California motorist by 2025.",72,197,"""Il ne s'agit pas de quelque chose que nous pourrions choisir de faire"", a déclaré Hasan Ikhrata, directeur exécutif de la Southern California Association of Governments, qui prévoit que l ""État commencera à suivre les kilomètres parcourus par chaque automobiliste californien d'ici 2025.","Hasan Ikhrata, directeur exécutif de la Southern Califokrnia Association of Governments, a déclaré : ""C'est une question de snot / une question que nous pourrions choisir de faire"". Hasan Ikhrata, directeur exécutif de la Southern Califokrnia Association of Governments, prévoit de commencer à suivre les kilomètres parcourus par tous les automobilistes californiens d'ici 2025.","« Ce n'est pas comme si nous avions le choix », a déclaré Hasan Ikhrata, directeur général de la Southern California Association of Governments, qui prévoit que l'État commence à enregistrer les miles parcourus par chaque automobiliste californien d'ici 2025.",212,"Failed"
"[[There]] is [[going]] to be a [[change]] [[in]] how we pay these [[taxes.]]","[[The~re]] is [[5going]] to be a [[chanJge]] [[iqn]] how we pay these [[taWxes.]]",14,52,"Il y aura un changement dans la façon dont nous payons ces impôts.","La façon dont nous payons ces txx va devenir un chanJge iqn.","Il va y avoir du changement dans la façon dont nous payons ces taxes.",212,"Failed"
"The [[technology]] is [[there]] to [[do]] [[it.]]","The [[Ctechnology]] is [[thqere]] to [[d8oC]] [[iFt.]]",0,39,"La technologie est là pour le faire.","La température de la technologie Ctechnology est de d8oC iFt.","La technologie est là pour le faire.",212,"Failed"
"The push [[comes]] as the country's Highway Trust Fund, [[financed]] with taxes [[Americans]] pay at the [[gas]] pump, is broke.","The push [[kcomes]] as the country's Highway Trust Fund, [[finZanced]] with taxes [[APmericanws]] pay at the [[ga4s]] pump, is broke.",42,115,"L'impulsion vient alors que le Highway Trust Fund du pays, financé par les impôts que les Américains paient à la pompe à essence, est en panne.","Le coup de pouce porté par le Fonds en fiducie pour les autoroutes du pays, dont les impôts sont versés par les membres de l'APMericanws à la pompe ga4s, est cassé.","La pression vient du fait que le Highway Trust Fund du pays, financé avec les taxes que les Américains paient à la pompe, est financièrement à sec.",212,"Failed"
"[[Americans]] [[don't]] buy as [[much]] [[gas]] as they used to.","[[Americans0]] [[do:n't]] buy as [[m/uch]] [[g,yas]] as they used to.",5,57,"Les Américains n'achètent plus autant d'essence qu'auparavant.","Americans0 do : n'achète pas en tant que m / uch g, yas comme ils avaient l'habitude.","Les Américains n'achètent plus autant d'essence qu'avant.",212,"Failed"
"Cars get many [[more]] miles [[to]] [[the]] gallon.","Cars get many [[mFore]] miles [[@toK]] [[t<h&e]] gallon.",20,41,"Les voitures ont beaucoup plus de kilomètres au gallon.","Les voitures obtiennent de nombreux milles parcourus @ tok t < h & e gallon.","Les voitures peuvent parcourir plus de miles avec un gallon.",212,"Failed"
"The federal [[tax]] [[itself,]] 18.4 cents per [[gallon,]] hasn't gone up in [[20]] years.","The federal [[tagx]] [[itselfN,]] 18.4 cents per [[gall)on,]] hasn't gone up in [[F{20]] years.",20,55,"L'impôt fédéral lui-même, qui est de 18,4 cents le gallon, n'a pas augmenté en 20 ans.","The federal tagx itself N, 18.4 cents per gall) on, has not gone up in F {20 years.","La taxe fédérale elle-même, qui est de 18,4 cents par gallon, n'a pas augmenté depuis 20 ans.",212,"Failed"
"Politicians are [[loath]] to raise [[the]] tax even one [[penny]] when [[gas]] [[prices]] are high.","Politicians are [[lo:ath]] to raise [[t+he]] tax even one [[Npenny]] when [[gasB]] [[pr%ices]] are high.",53,89,"Les politiciens répugnent à augmenter la taxe ne serait-ce que d'un sou lorsque les prix du gaz sont élevés.","Les politiciens ne sont pas du tout d'accord : il faut augmenter le taux d'imposition ne serait-ce que d'un sou quand les taux d'imposition sont élevés.","Les hommes politiques sont réticents à augmenter la taxe, même d'1 cent, alors que les prix de l'essence sont élevés.",212,"Failed"
"""The gas tax [[is]] just [[not]] sustainable,"" said Lee [[Munnich,]] a [[transportation]] policy expert at the University of Minnesota.","""The gas tax [[iLs]] just [[nGot]] sustainable,"" said Lee [[M=unenich,]] a [[transpBortation]] policy expert at the University of Minnesota.",13,137,"""La taxe sur l'essence n'est tout simplement pas viable"", a déclaré Lee Munnich, spécialiste des politiques de transport à l'Université du Minnesota.","Lee M = unenich, spécialiste des politiques de transpBortation à l'Université du Minnesota, a déclaré que ""la taxe sur l'essence sur les carburants est tout simplement viable"".","« La taxe sur l'essence n'est tout simplement pas tenable », a déclaré Lee Munnich, un spécialiste des politiques de transports à l'université du Minnesota.",212,"Failed"
"His state [[recently]] put [[tracking]] devices on 500 cars to [[test]] [[out]] a [[pay-by-mile]] system.","His state [[recen<tly]] put [[tra/cking]] devices on 500 cars to [[t[est]] [[ouFt]] a [[pay-by-miDle]] system.",29,99,"Son État a récemment installé des dispositifs de repérage sur 500 voitures pour tester un système de paiement au mille.","Son etat reconnaıˆ t '' '' '' '' '' 'que 500 voitures sont munies de dispositifs de traçage et de cking pour mettre en place un systeme de paiement par mi-temps.","Son État a récemment fait installer des traceurs sur 500 voitures pour tester un système de paiement au mile.",212,"Failed"
"""This works [[out]] [[as]] the [[most]] [[logical]] [[alternative]] over the long term,"" he said.","""This works [[oFut]] [[aYs]] the [[mos)t]] [[logical%]] [[alternati""ve]] over the long term,"" he said.",29,70,"""Il s'agit de la solution la plus logique à long terme"", a-t-il déclaré.","""Cela fonctionne à long terme"", a-t-il dit, ""mais il n'y a pas de solution de rechange logique"".","« Cela s'avère être l'alternative la plus logique à long terme », a-t-il dit.",212,"Failed"
"Wonks [[call]] it a [[mileage-based]] [[user]] fee.","Wonks [[callj]] it a [[mileatg{e-basedv]] [[ruser]] fee.",19,70,"Wonks l'appelle un frais d'utilisation basé sur le kilométrage.","The hotel is very close to the airport and the train station. The room was clean and comfortable.","Wonks appelle cela des frais d'utilisation au kilométrage.",212,"Failed"
"It is no [[surprise]] that the idea appeals to [[urban]] liberals, [[as]] the taxes could be rigged to change [[driving]] patterns in ways that could help reduce congestion and greenhouse gases, [[for]] example.","It is no [[sur/prise]] that the idea appeals to [[urlban]] liberals, [[as+]] the taxes could be rigged to change [[dri;ving]] patterns in ways that could help reduce congestion and greenhouse gases, [[fCor]] example.",87,157,"Il n'est pas surprenant que cette idée plaise aux libéraux urbains, car les taxes pourraient être manipulées pour changer les habitudes de conduite de manière à réduire la congestion et les gaz à effet de serre, par exemple.","It is no sur / prise that the idea appeal to urlban liberals, as + the taxes could be rigged to change dri ; ving patterns in ways that could help reduce congestion and greenhouse gases, fCor example.","Il n'est pas surprenant que l'idée séduise les libéraux citadins, puisque les taxes pourraient servir à modifier les habitudes de conduite de manière à permettre de réduire les encombrements et les émissions de gaz, par exemple.",212,"Failed"
"California [[planners]] are [[looking]] to the system as they [[devise]] strategies to meet the goals laid out in the state's [[ambitious]] global [[warming]] laws.","California [[plXanners]] are [[looHking]] to the system as they [[de""vise]] strategies to meet the goals laid out in the state's [[ambitiVous]] global [[warm%ing]] laws.",38,138,"Les planificateurs californiens se tournent vers le système lorsqu'ils élaborent des stratégies pour atteindre les objectifs énoncés dans les ambitieuses lois de l'État sur le réchauffement climatique.","California plXanners are looHking to the system as they ""vise strategies to meet the goals set out in the State's ambitiglobal warm % ing laws.","Les planificateurs de Californie s'intéressent au système puisqu'ils élaborent des stratégies pour atteindre les objectifs fixés dans les lois ambitieuses de l'État sur le réchauffement climatique.",212,"Failed"
"But [[Rep.]] Bill [[Shuster]] (R-Pa.), chairman of [[the]] House Transportation Committee, has said he, too, sees [[it]] as the most viable long-term [[alternative.]]","But [[Repn.]] Bill [[Shusterh]] (R-Pa.), chairman of [[th|e]] House Transportation Committee, has said he, too, sees [[itJ]] as the most viable long-term [[alterhnative.]]",55,134,"Mais le représentant Bill Shuster (R-Pa.), président du Comité des transports de la Chambre, a dit qu'il considérait lui aussi qu'il s'agissait de la solution la plus viable à long terme.","Bill Shusterh (R-Pa.), Chairman of the | e House Transportation Committee, has said he, too, sees itJ as the most viable long-term alterhnative.","Mais le représentant Bill Shuster (R-Pa.), président du Comité des transports de la Chambre des représentants, a déclaré qu'il le considérait aussi comme l'alternative la plus viable à long terme.",212,"Failed"
"The free marketeers at [[the]] Reason [[Foundation]] [[are]] also fond [[of]] having drivers pay per mile.","The free marketeers at [[t)h}e]] Reason [[Foundatiobn]] [[anre]] also fond [[omf]] having drivers pay per mile.",71,89,"Les libéraux de la Reason Foundation adorent également que les chauffeurs paient le kilomètre.","The free marketeers at t) h} e Raison (Anglais) Foundatiobn anre also fond omf having drivers pay per mile.","Les partisans du marché libre de la fondation Reason apprécient également l'idée de faire payer les conducteurs au mile.",212,"Failed"
"""This is not just a tax [[going]] into a [[black]] hole,"" [[said]] Adrian Moore, vice president of [[policy]] at [[Reason.]]","""This is not just a tax [[g`oing]] into a [[2black]] hole,"" [[s|aid]] Adrian Moore, vice president of [[po?licy]] at [[Reaso3n.]]",40,124,"""Il ne s'agit pas simplement d'une taxe qui entre dans un trou noir"", a déclaré Adrian Moore, vice-président des politiques chez Reason.","Adrian Moore, vice-président de la po ? licy chez Reaso3n, a déclaré : ""Ce n'est pas seulement une question d'impôts qui s'enfonce dans un trou noir.","« Il ne s'agit pas simplement d'une taxe s'engouffrant dans un grand trou noir », a déclaré Adrian Moore, vice-président de la politique à la fondation Reason.",212,"Failed"
"[[People]] are paying more [[directly]] into what [[they]] [[are]] getting.","[[Peopl]e]] are paying more [[xdirecatly]] into what [[Sthey]] [[aret]] getting.",40,73,"Les gens contribuent plus directement à ce qu'ils reçoivent.","Mmmmmmmmmmmmmmmmmmmmmmmm.","Les gens paient plus directement pour les avantages qui leur sont procurés.",212,"Failed"
"The movement is also bolstered [[by]] two former U.S. [[Transportation]] [[secretaries,]] who in a [[2011]] report urged Congress to move in the pay-per-mile [[direction.]]","The movement is also bolstered [[bFy]] two former U.S. [[Transp5ortation]] [[secret_aries,]] who in a [[20)11]] report urged Congress to move in the pay-per-mile [[directio7n.]]",55,131,"Le mouvement est également soutenu par deux anciens secrétaires des Transports des États-Unis qui, dans un rapport publié en 2011, ont exhorté le Congrès à adopter la direction du paiement au mille.","The movement is also bolstered bFy two former U.S. Transp5ortation secret _ aries, who in a 20) 11 report urged Congress to move in the pay-per-mile directio7n.","Le mouvement est également soutenu par deux anciens secrétaires américains aux Transports qui, dans un rapport de 2011, exhortaient le Congrès à aller dans la voie du paiement au mile.",212,"Failed"
"The [[U.S.]] Senate [[approved]] a $90-million [[pilot]] project last year that [[would]] have involved about [[10,000]] cars.","The [[/U.S.]] Senate [[a)pproved]] a $90-million [[opilot]] project last year that [[wouldS]] have involved about [[10m,000]] cars.",31,91,"L'an dernier, le Sénat américain a approuvé un projet pilote de 90 millions de dollars qui aurait porté sur environ 10 000 voitures.","L'an dernier, le Sénat des États-Unis a) a prouvé qu'un projet de 90 millions de dollars en matière de systèmes de pilotage optique concernait environ 10 000 voitures.","Le Sénat américain a approuvé un projet pilote de 90 M$ l'année dernière qui aurait porté sur environ 10 000 voitures.",212,"Failed"
"But the House [[leadership]] [[killed]] the proposal, acting on concerns of rural lawmakers representing constituents [[whose]] daily lives often involve logging [[lots]] of miles to [[get]] to work or into town.","But the House [[l:eadership]] [[kLilled]] the proposal, acting on concerns of rural lawmakers representing constituents [[wh=ose]] daily lives often involve logging [[lo[ts]] of miles to [[getT]] to work or into town.",82,162,"Mais les dirigeants de la Chambre ont mis fin à la proposition, répondant aux préoccupations des législateurs ruraux représentant les électeurs dont la vie quotidienne implique souvent d'abattre de nombreux kilomètres pour se rendre au travail ou en ville.","Mais la Chambre 1 : eadership kLilled the proposal, acting on concerns of rural lawmakers representing constituents wh = ose daily lives often involve logging lo [ts of miles to getT to work or into town.","Mais la présidence de la Chambre a tué la proposition, répondant aux préoccupations des législateurs ruraux représentant des électeurs qui doivent parcourir de nombreux miles tous les jours pour se rendre à leur travail ou en ville.",212,"Failed"
