"original_text","perturbed_text","original_score","perturbed_score","original_output","perturbed_output","ground_truth_output","num_queries","result_type"
"[[Several]] states [[and]] [[cities]] are [[nonetheless]] moving [[ahead]] on their own.","[[Severa\l]] states [[=and]] [[ci7ties]] are [[nonethNeless]] moving [[ah(ead]] on their own.",35,80,"Plusieurs États et villes progressent néanmoins d'eux-mêmes.","Les états Severa \ l = et ci7ties ne sont pas des mouvements sans appartenance ethnique ah (ead par eux-mêmes.","Plusieurs États et grandes villes font néanmoins des progrès de leur côté.",212,"Failed"
"The most eager [[is]] Oregon, which is enlisting [[5,000]] drivers in the country's biggest [[experiment.]]","The most eager [[i]s]] Oregon, which is enlisting [[5,0Q00]] drivers in the country's biggest [[eL52xperiment.]]",52,105,"Le plus enthousiaste est l'Oregon, qui recrute 5 000 conducteurs dans le cadre de la plus grande expérience du pays.","The most eL52xperiment is the most eL52xperiment in Oregon, which is recruiting 5,0Q00 drivers in the country's largest eL52xperiment.","Le plus déterminé est l'Oregon, qui a mobilisé 5 000 conducteurs pour mener l'expérience la plus importante du pays.",212,"Failed"
"[[Those]] [[drivers]] will soon [[pay]] the mileage fees [[instead]] of gas [[taxes]] to the state.","[[Those(]] [[driVvers]] will soon [[payq]] the mileage fees [[in~stead]] of gas [[tax&es]] to the state.",22,72,"Ces conducteurs paieront bientôt à l ""État les frais de kilométrage au lieu des taxes sur l'essence.","Ceux-ci (driVvers will soon pay q the mileage fees in ~ instead of gas tax & es to the state.","Ces automobilistes paieront bientôt à l'État des frais kilométriques au lieu des taxes sur l'essence.",212,"Failed"
"Nevada has [[already]] [[completed]] [[a]] [[pilot.]]","Nevada has [[alreadyN]] [[comp^leted]] [[aL]] [[piloL@t.]]",10,50,"Le Nevada a déjà terminé un projet pilote.","Le Nevada dispose d'un système de contrôle de la circulation aérienne piloL @ t.","Le Nevada a déjà mené à terme un projet pilote.",212,"Failed"
"New York [[City]] is [[looking]] [[into]] one.","New York [[Ci7txy]] is [[loDoking]] [[Zimnto]] one.",17,60,"La ville de New York envisage d'en adopter une.","The staff were very friendly and helpful. The room was clean and comfortable.","La ville de New York en envisage un.",212,"Failed"
"Illinois is trying it [[on]] a [[limited]] basis with [[trucks.]]","Illinois is trying it [[on7]] a [[libmit;ed]] basis with [[trucTFks.]]",23,46,"L'Illinois l'essaie sur une base limitée avec des camions.","Illinois est en train de l'essayer une fois 7 un libmit ; ed base avec trucTFks.","L'Illinois tente un essai sur un nombre limité de camions.",212,"Failed"
"[[And]] the I-95 Coalition, [[which]] [[includes]] 17 state [[transportation]] departments along the Eastern [[Seaboard]] (including Maryland, Pennsylvania, Virginia and Florida), is studying how they could go about implementing the change.","[[Andn]] the I-95 Coalition, [[wvhich]] [[inclu=des]] 17 state [[transp-ortation]] departments along the Eastern [[S1eaboard]] (including Maryland, Pennsylvania, Virginia and Florida), is studying how they could go about implementing the change.",79,155,"Et la Coalition I-95, qui comprend 17 services de transport d'État le long de la côte est (y compris le Maryland, la Pennsylvanie, la Virginie et la Floride), étudie comment ils pourraient procéder pour mettre en œuvre le changement.","Andn the I-95 Coalition, wvhich inclu = des 17 state transp-ortation departments along the Eastern S1eaboard (including Maryland, Pennsylvania, Virginia and Florida), is studying how they could go about implementing the change.","Et la coalition I-95, qui comprend 17 agences impliquées dans le transport routier dans des États longeant la côte est américaine (comprenant le Maryland, la Pennsylvanie, la Virginie et la Floride) étudie comment elle pourrait mettre en œuvre le changement.",212,"Failed"
"The [[concept]] [[is]] not a [[universal]] hit.","The [[c%onc%ep_t]] [[i3s]] not a [[unive<rsal]] hit.",0,31,"Le concept n'est pas un succès universel.","The c % onc % ep _ t i3s not a unive < rsal hit.","Le concept n'est pas un succès universel.",212,"Failed"
"In Nevada, where about 50 volunteers' [[cars]] were equipped with the devices not long ago, [[drivers]] were uneasy [[about]] the [[government]] [[being]] able to monitor their every move.","In Nevada, where about 50 volunteers' [[cars#]] were equipped with the devices not long ago, [[drive6rs]] were uneasy [[aboNut]] the [[gover9nment]] [[beingp]] able to monitor their every move.",118,155,"Au Nevada, où une cinquantaine de voitures de volontaires étaient équipées de ces dispositifs il n'y a pas si longtemps, les conducteurs ne voyaient pas d'un bon œil que le gouvernement puisse surveiller leurs déplacements.","Au Nevada, où une cinquantaine de voitures de bénévoles # étaient équipées de ces dispositifs il n'y a pas si longtemps, les automobilistes étaient mal à l'aise au nord de Nut le jour où le gouvernement était en mesure de surveiller leurs moindres mouvements.","Dans le Nevada, où environ 50 automobilistes volontaires ont récemment équipé leur voiture d'un appareil, les conducteurs étaient inquiets que le gouvernement puisse suivre leurs moindres faits et gestes.",212,"Failed"
"""Concerns about [[Big]] Brother and [[those]] sorts of things were a major [[problem,""]] said Alauddin Khan, who directs strategic and performance management at [[the]] Nevada Department of [[Transportation.]]","""Concerns about [[BSig]] Brother and [[thorse]] sorts of things were a major [[problem,8""]] said Alauddin Khan, who directs strategic and performance management at [[the~]] Nevada Department of [[Transp:ortation.]]",65,185,"""Les préoccupations au sujet de Big Brother et de ce genre de choses constituaient un problème majeur"", a déclaré Alauddin Khan, qui dirige la gestion stratégique et la gestion du rendement au ministère des Transports du Nevada.","Alauddin Khan, qui dirige la gestion stratégique et la gestion du rendement au département de la Transp : ortation du Nevada, a déclaré : ""Les inquiétudes au sujet du BSig Brother et de certaines choses épineuses constituaient un problème majeur.","« Les inquiétudes au sujet de Big Brother et ce genre de choses sont un gros problème », a déclaré Alauddin Khan, qui dirige la gestion stratégique de la performance au département des Transports du Nevada.",212,"Failed"
"It was [[not]] [[something]] [[people]] [[wanted.]]","It was [[ntot]] [[soGmething]] [[peopleV]] [[wVan/ted.]]",18,58,"Ce n'était pas ce que les gens voulaient.","The staff were very friendly and helpful. The room was clean and comfortable.","Ce n'est pas quelque chose que les gens veulent.",212,"Failed"
"As the trial got underway, the ACLU of Nevada warned on [[its]] website: [[""It]] [[would]] be fairly easy to [[turn]] these devices into full-fledged tracking devices.""","As the trial got underway, the ACLU of Nevada warned on [[i$^ts]] website: [[""It2]] [[wouFld]] be fairly easy to [[turn4]] these devices into full-fledged tracking devices.""",77,133,"Alors que l'essai était en cours, l'ACLU du Nevada a mis en garde sur son site Web : ""Il serait assez facile de transformer ces dispositifs en dispositifs de suivi à part entière"".","Alors que l'essai était en cours, l'ACLU du Nevada a lancé un avertissement sur le site Web i $^ ts : ""It2 wouFld be fairly easy to turn 4 these devices into full-fledged tracking devices"".","Dès le début de l'essai, l'ACLU du Nevada avertissait sur son site : « Ce serait relativement facile de transformer ces appareils en dispositifs de localisation à part entière. »",212,"Failed"
"There is no need to build an enormous, unwieldy [[technological]] infrastructure that will [[inevitably]] be [[expanded]] [[to]] [[keep]] records of individuals' everyday comings and goings.","There is no need to build an enormous, unwieldy [[tehchnological]] infrastructure that will [[inevMitably]] be [[[expanded]] [[tMo]] [[keep`]] records of individuals' everyday comings and goings.",36,143,"Il n'est pas nécessaire de construire une infrastructure technologique énorme et lourde qui sera inévitablement élargie pour enregistrer les allées et venues quotidiennes des individus.","There is no need to build an enormous, unwieldy tehchnological infrastructure that will inevably be Mitably [expanded tMo keepested records of individuals 'everyday comings and goings.","Il n'est pas nécessaire de construire une infrastructure technologique énorme et encombrante qui sera inévitablement élargie pour conserver les enregistrements des allées et venues quotidiennes des gens.",212,"Failed"
"[[Nevada]] is among several states now [[scrambling]] to find affordable technology that would allow the state to keep track [[of]] how many miles a [[car]] is being driven, but not exactly where and at what time.","[[Nevada,S]] is among several states now [[scramblin]g]] to find affordable technology that would allow the state to keep track [[osf]] how many miles a [[calr]] is being driven, but not exactly where and at what time.",78,165,"Le Nevada est l'un des États qui se démènent actuellement pour trouver une technologie abordable qui permettrait à l'État de suivre le nombre de kilomètres parcourus par une voiture, mais pas exactement où ni à quel moment.","Nevada, S est aujourd'hui parmi plusieurs États scramblin] g to find affordable technology that would allow the state to keep track osf how many miles a calr is being driven, but not exactly where and at which time.","Le Nevada fait partie des quelques États qui se démènent désormais pour trouver une technologie abordable qui permettrait à l'État de savoir combien de miles parcourt une voiture, mais sans connaître le lieu ni l'heure exacts.",212,"Failed"
"If you [[can]] do that, [[Khan]] said, [[the]] public gets [[more]] comfortable.","If you [[ca}n]] do that, [[KhaGEn]] said, [[tZhe]] public gets [[mor)e]] comfortable.",34,59,"Si vous pouvez le faire, dit Khan, le public se sentira plus à l'aise.","Si vous n'avez pas ca} n faire cela, KhaGEn dit, tZhe public obtient mor) e confortable.","Si on peut faire ça, a ajouté Khan, les citoyens seront plus à l'aise.",212,"Failed"
