"original_text","perturbed_text","original_score","perturbed_score","original_output","perturbed_output","ground_truth_output","num_queries","result_type"
"Nevada [[has]] already completed a pilot.","Nevada [[һas]] already completed a pilot.",10,29,"Le Nevada a déjà terminé un projet pilote.","Nevada as already completed a pilot.","Le Nevada a déjà mené à terme un projet pilote.",23,"Failed"
"New York [[City]] is looking into one.","New York [[Cіty]] is looking into one.",17,38,"La ville de New York envisage d'en adopter une.","New York Cіty étudie la possibilité d'en créer un.","La ville de New York en envisage un.",23,"Failed"
"Illinois is trying [[it]] on a limited basis with trucks.","Illinois is trying [[іt]] on a limited basis with trucks.",23,37,"L'Illinois l'essaie sur une base limitée avec des camions.","L'Illinois essaie d'utiliser des camions de façon limitée.","L'Illinois tente un essai sur un nombre limité de camions.",23,"Failed"
"And the I-95 Coalition, which includes 17 state transportation departments along the Eastern Seaboard (including Maryland, Pennsylvania, Virginia and Florida), [[is]] studying how they could go about implementing the change.","And the I-95 Coalition, which includes 17 state transportation departments along the Eastern Seaboard (including Maryland, Pennsylvania, Virginia and Florida), [[іs]] studying how they could go about implementing the change.",79,99,"Et la Coalition I-95, qui comprend 17 services de transport d'État le long de la côte est (y compris le Maryland, la Pennsylvanie, la Virginie et la Floride), étudie comment ils pourraient procéder pour mettre en œuvre le changement.","Et la Coalition I-95, qui comprend 17 services de transport d ""État le long de la côte est (y compris le Maryland, la Pennsylvanie, la Virginie et la Floride), des entreprises qui étudient comment elles pourraient procéder pour mettre en œuvre le changement.","Et la coalition I-95, qui comprend 17 agences impliquées dans le transport routier dans des États longeant la côte est américaine (comprenant le Maryland, la Pennsylvanie, la Virginie et la Floride) étudie comment elle pourrait mettre en œuvre le changement.",23,"Failed"
"The concept is not a [[universal]] hit.","The concept is not a [[univеrsal]] hit.",0,15,"Le concept n'est pas un succès universel.","Le concept n'est pas univеrsal hit.","Le concept n'est pas un succès universel.",23,"Failed"
"In Nevada, where about 50 volunteers' cars were equipped with the devices not long ago, drivers were uneasy about the government being [[able]] to monitor their every move.","In Nevada, where about 50 volunteers' cars were equipped with the devices not long ago, drivers were uneasy about the government being [[ablе]] to monitor their every move.",118,126,"Au Nevada, où une cinquantaine de voitures de volontaires étaient équipées de ces dispositifs il n'y a pas si longtemps, les conducteurs ne voyaient pas d'un bon œil que le gouvernement puisse surveiller leurs déplacements.","Au Nevada, où une cinquantaine de voitures de volontaires ont été équipées de ces dispositifs il n'y a pas si longtemps, les conducteurs ne voyaient pas d'un bon œil que le gouvernement s'empresse de surveiller leurs déplacements.","Dans le Nevada, où environ 50 automobilistes volontaires ont récemment équipé leur voiture d'un appareil, les conducteurs étaient inquiets que le gouvernement puisse suivre leurs moindres faits et gestes.",23,"Failed"
"""Concerns about Big Brother and [[those]] sorts of things were a major problem,"" said Alauddin Khan, who directs strategic and performance management at the Nevada Department of Transportation.","""Concerns about Big Brother and [[thoѕe]] sorts of things were a major problem,"" said Alauddin Khan, who directs strategic and performance management at the Nevada Department of Transportation.",65,174,"""Les préoccupations au sujet de Big Brother et de ce genre de choses constituaient un problème majeur"", a déclaré Alauddin Khan, qui dirige la gestion stratégique et la gestion du rendement au ministère des Transports du Nevada.","Alauddin Khan, qui dirige la gestion stratégique et la gestion du rendement au ministère des Transports du Nevada, a déclaré : ""Les préoccupations au sujet de Big Brother et de toutes sortes de choses constituaient un problème majeur.","« Les inquiétudes au sujet de Big Brother et ce genre de choses sont un gros problème », a déclaré Alauddin Khan, qui dirige la gestion stratégique de la performance au département des Transports du Nevada.",23,"Failed"
"It was not [[something]] people wanted.","It was not [[somethіng]] people wanted.",18,33,"Ce n'était pas ce que les gens voulaient.","Ce n ""était pas un vœu pieux.","Ce n'est pas quelque chose que les gens veulent.",23,"Failed"
"As the trial got underway, the ACLU of Nevada warned on its website: ""It would be fairly easy to turn these devices [[into]] full-fledged tracking devices.""","As the trial got underway, the ACLU of Nevada warned on its website: ""It would be fairly easy to turn these devices [[іnto]] full-fledged tracking devices.""",77,99,"Alors que l'essai était en cours, l'ACLU du Nevada a mis en garde sur son site Web : ""Il serait assez facile de transformer ces dispositifs en dispositifs de suivi à part entière"".","Alors que l'essai était en cours, l'ACLU du Nevada a mis en garde sur son site Web : ""Il serait assez facile de transformer ces dispositifs іnen véritables dispositifs de suivi"".","Dès le début de l'essai, l'ACLU du Nevada avertissait sur son site : « Ce serait relativement facile de transformer ces appareils en dispositifs de localisation à part entière. »",23,"Failed"
"There is no need to build an enormous, unwieldy technological infrastructure that will inevitably be expanded to keep records of individuals' everyday [[comings]] and goings.","There is no need to build an enormous, unwieldy technological infrastructure that will inevitably be expanded to keep records of individuals' everyday [[сomings]] and goings.",36,69,"Il n'est pas nécessaire de construire une infrastructure technologique énorme et lourde qui sera inévitablement élargie pour enregistrer les allées et venues quotidiennes des individus.","Il n'est pas nécessaire de mettre en place une infrastructure technologique énorme et lourde qui sera inévitablement étendue pour enregistrer les activités et les faits quotidiens des individus.","Il n'est pas nécessaire de construire une infrastructure technologique énorme et encombrante qui sera inévitablement élargie pour conserver les enregistrements des allées et venues quotidiennes des gens.",23,"Failed"
"Nevada is among several states now scrambling to find affordable technology that would allow the state to keep track of how many miles a car [[is]] being driven, but not exactly where and at what time.","Nevada is among several states now scrambling to find affordable technology that would allow the state to keep track of how many miles a car [[iѕ]] being driven, but not exactly where and at what time.",78,93,"Le Nevada est l'un des États qui se démènent actuellement pour trouver une technologie abordable qui permettrait à l'État de suivre le nombre de kilomètres parcourus par une voiture, mais pas exactement où ni à quel moment.","Le Nevada est l'un des États qui s'efforcent actuellement de trouver une technologie abordable qui permettrait à l ""État de surveiller le nombre de kilomètres parcourus par une voiture, mais pas exactement où ni à quel moment.","Le Nevada fait partie des quelques États qui se démènent désormais pour trouver une technologie abordable qui permettrait à l'État de savoir combien de miles parcourt une voiture, mais sans connaître le lieu ni l'heure exacts.",23,"Failed"
"If you can do that, Khan said, the public gets [[more]] comfortable.","If you can do that, Khan said, the public gets [[morе]] comfortable.",34,54,"Si vous pouvez le faire, dit Khan, le public se sentira plus à l'aise.","Si vous pouvez le faire, dit Khan, le public se sentira à l'aise sur le plan moral.","Si on peut faire ça, a ajouté Khan, les citoyens seront plus à l'aise.",23,"Failed"
