"original_text","perturbed_text","original_score","perturbed_score","original_output","perturbed_output","ground_truth_output","num_queries","result_type"
"Nevada has already [[completed]] a pilot.","Nevada has already [[complete,d]] a pilot.",10,30,"Le Nevada a déjà terminé un projet pilote.","Nevada has already completed, d a pilot.","Le Nevada a déjà mené à terme un projet pilote.",44,"Failed"
"New York [[City]] is looking into one.","New York [[Czity]] is looking into one.",17,41,"La ville de New York envisage d'en adopter une.","New York Czity étudie la possibilité d'en adopter une.","La ville de New York en envisage un.",44,"Failed"
"Illinois is trying it on a limited basis with [[trucks.]]","Illinois is trying it on a limited basis with [[tlrucks.]]",23,44,"L'Illinois l'essaie sur une base limitée avec des camions.","L'Illinois l'essaie sur une base limitée avec des goulots d ""étranglement.","L'Illinois tente un essai sur un nombre limité de camions.",44,"Failed"
"And the I-95 Coalition, which includes 17 state transportation departments along the Eastern Seaboard (including [[Maryland,]] Pennsylvania, Virginia and Florida), is studying how they could go about implementing the change.","And the I-95 Coalition, which includes 17 state transportation departments along the Eastern Seaboard (including [[MarylanAd,]] Pennsylvania, Virginia and Florida), is studying how they could go about implementing the change.",79,93,"Et la Coalition I-95, qui comprend 17 services de transport d'État le long de la côte est (y compris le Maryland, la Pennsylvanie, la Virginie et la Floride), étudie comment ils pourraient procéder pour mettre en œuvre le changement.","Et la Coalition I-95, qui comprend 17 services de transport d'État le long de la côte Est (y compris MarylanAd, Pennsylvanie, Virginie et Floride), étudie comment ils pourraient procéder pour mettre en œuvre le changement.","Et la coalition I-95, qui comprend 17 agences impliquées dans le transport routier dans des États longeant la côte est américaine (comprenant le Maryland, la Pennsylvanie, la Virginie et la Floride) étudie comment elle pourrait mettre en œuvre le changement.",44,"Failed"
"The concept is not a [[universal]] hit.","The concept is not a [[urniversal]] hit.",0,19,"Le concept n'est pas un succès universel.","Le concept n'est pas un coup d'épée dans l'eau.","Le concept n'est pas un succès universel.",44,"Failed"
"In Nevada, where about 50 volunteers' cars were equipped with the devices not long ago, drivers were uneasy about [[the]] government being able to monitor their every move.","In Nevada, where about 50 volunteers' cars were equipped with the devices not long ago, drivers were uneasy about [[tNhe]] government being able to monitor their every move.",118,139,"Au Nevada, où une cinquantaine de voitures de volontaires étaient équipées de ces dispositifs il n'y a pas si longtemps, les conducteurs ne voyaient pas d'un bon œil que le gouvernement puisse surveiller leurs déplacements.","Au Nevada, oÃ ¹ une cinquantaine de voitures de bÃ © nÃ © voles Ã © taient dotÃ © es de ces dispositifs il n'y a pas si longtemps, les conducteurs ne voyaient pas d'un bon oeil que le gouvernement puisse surveiller leurs déplacements.","Dans le Nevada, où environ 50 automobilistes volontaires ont récemment équipé leur voiture d'un appareil, les conducteurs étaient inquiets que le gouvernement puisse suivre leurs moindres faits et gestes.",44,"Failed"
"""Concerns about Big Brother and those sorts of things were a major [[problem,""]] said Alauddin Khan, who directs strategic and performance management at the Nevada Department of Transportation.","""Concerns about Big Brother and those sorts of things were a major [[prloblem,""]] said Alauddin Khan, who directs strategic and performance management at the Nevada Department of Transportation.",65,174,"""Les préoccupations au sujet de Big Brother et de ce genre de choses constituaient un problème majeur"", a déclaré Alauddin Khan, qui dirige la gestion stratégique et la gestion du rendement au ministère des Transports du Nevada.","Alauddin Khan, qui dirige la gestion stratégique et la gestion du rendement au ministère des Transports du Nevada, a déclaré : ""Les préoccupations au sujet de Big Brother et de ce genre de choses étaient un sujet de préoccupation majeur.","« Les inquiétudes au sujet de Big Brother et ce genre de choses sont un gros problème », a déclaré Alauddin Khan, qui dirige la gestion stratégique de la performance au département des Transports du Nevada.",44,"Failed"
"It was not something [[people]] wanted.","It was not something [[peopsle]] wanted.",18,27,"Ce n'était pas ce que les gens voulaient.","Ce n'était pas ce que désirait peopsle.","Ce n'est pas quelque chose que les gens veulent.",44,"Failed"
"As the trial got underway, the ACLU of Nevada warned on its website: ""It would be fairly easy to turn these [[devices]] into full-fledged tracking devices.""","As the trial got underway, the ACLU of Nevada warned on its website: ""It would be fairly easy to turn these [[deBvices]] into full-fledged tracking devices.""",77,96,"Alors que l'essai était en cours, l'ACLU du Nevada a mis en garde sur son site Web : ""Il serait assez facile de transformer ces dispositifs en dispositifs de suivi à part entière"".","Alors que le procès était en cours, l'ACLU du Nevada a prévenu sur son site web : ""Il serait assez facile de transformer ces deBvices en véritables dispositifs de suivi"".","Dès le début de l'essai, l'ACLU du Nevada avertissait sur son site : « Ce serait relativement facile de transformer ces appareils en dispositifs de localisation à part entière. »",44,"Failed"
"There is no need to build an enormous, unwieldy technological infrastructure that will inevitably be expanded to keep records of individuals' everyday [[comings]] and goings.","There is no need to build an enormous, unwieldy technological infrastructure that will inevitably be expanded to keep records of individuals' everyday [[c>omings]] and goings.",36,64,"Il n'est pas nécessaire de construire une infrastructure technologique énorme et lourde qui sera inévitablement élargie pour enregistrer les allées et venues quotidiennes des individus.","Il n'est pas nécessaire de mettre en place une infrastructure technologique énorme et lourde qui sera inévitablement élargie pour enregistrer les activités et les faits quotidiens des individus.","Il n'est pas nécessaire de construire une infrastructure technologique énorme et encombrante qui sera inévitablement élargie pour conserver les enregistrements des allées et venues quotidiennes des gens.",44,"Failed"
"Nevada is among several states now [[scrambling]] to find affordable technology that would allow the state to keep track of how many miles a car is being driven, but not exactly where and at what time.","Nevada is among several states now [[scrambli,ng]] to find affordable technology that would allow the state to keep track of how many miles a car is being driven, but not exactly where and at what time.",78,112,"Le Nevada est l'un des États qui se démènent actuellement pour trouver une technologie abordable qui permettrait à l'État de suivre le nombre de kilomètres parcourus par une voiture, mais pas exactement où ni à quel moment.","Le Nevada est aujourd'hui parmi plusieurs états à scrambli, ng pour trouver une technologie abordable qui permettrait à l'état de tenir compte de combien de kilomètres une voiture est conduite, mais pas exactement où et à quel moment.","Le Nevada fait partie des quelques États qui se démènent désormais pour trouver une technologie abordable qui permettrait à l'État de savoir combien de miles parcourt une voiture, mais sans connaître le lieu ni l'heure exacts.",44,"Failed"
"[[If]] you can do that, Khan said, the public gets more comfortable.","[[IfV]] you can do that, Khan said, the public gets more comfortable.",34,49,"Si vous pouvez le faire, dit Khan, le public se sentira plus à l'aise.","IfV vous pouvez le faire, Khan a dit, le public devient plus confortable.","Si on peut faire ça, a ajouté Khan, les citoyens seront plus à l'aise.",44,"Failed"
