"original_text","perturbed_text","original_score","perturbed_score","original_output","perturbed_output","ground_truth_output","num_queries","result_type"
"""This is not just a tax going into a black hole,"" [[said]] [[Adrian]] Moore, vice president of policy at Reason.","""This is not just a tax going into a black hole,"" [[‭⁦‮⁦a⁩⁦s⁩‬⁩‬id‭⁦‮⁦A⁩⁦]] [[⁩‬⁩‬drian]] Moore, vice president of policy at Reason.",40,144,"""Il ne s'agit pas simplement d'une taxe qui entre dans un trou noir"", a déclaré Adrian Moore, vice-président des politiques chez Reason.","""Il ne s'agit pas seulement d'une taxe qui entre dans un trou noir"", ""une taxe qui pénètre dans un trou noir"", ""une taxe qui pénètre dans un trou noir"", ""une taxe qui pénètre dans un trou noir"", ""une taxe qui pénètre dans un trou noir"".","« Il ne s'agit pas simplement d'une taxe s'engouffrant dans un grand trou noir », a déclaré Adrian Moore, vice-président de la politique à la fondation Reason.",44,"Failed"
"People [[are]] paying more directly [[into]] what they are getting.","People [[a‭⁦‮⁦e⁩⁦r⁩‬⁩‬]] paying more directly [[i‭⁦‮⁦t⁩⁦n⁩‬⁩‬o]] what they are getting.",40,170,"Les gens contribuent plus directement à ce qu'ils reçoivent.","Les gens versent plus directement leurs cotisations, tandis que les autres payent moins directement leurs cotisations. Les gens paient plus directement leurs cotisations, tandis que les autres payent moins directement leurs cotisations.","Les gens paient plus directement pour les avantages qui leur sont procurés.",44,"Failed"
"The movement is also bolstered [[by]] two [[former]] U.S. Transportation secretaries, who in a 2011 report urged Congress to move in the pay-per-mile direction.","The movement is also bolstered [[‭⁦‮⁦y⁩⁦b⁩‬⁩‬]] two [[for‭⁦‮⁦e⁩⁦m⁩‬⁩‬r]] U.S. Transportation secretaries, who in a 2011 report urged Congress to move in the pay-per-mile direction.",55,225,"Le mouvement est également soutenu par deux anciens secrétaires des Transports des États-Unis qui, dans un rapport publié en 2011, ont exhorté le Congrès à adopter la direction du paiement au mille.","Le mouvement est également renforcé. Septième génération Septième génération Septième génération Septième génération Septième génération Septième génération Septième génération Septième génération Septième génération Septième génération Septième génération Septième génération Septième génération Septième génération","Le mouvement est également soutenu par deux anciens secrétaires américains aux Transports qui, dans un rapport de 2011, exhortaient le Congrès à aller dans la voie du paiement au mile.",44,"Failed"
"The U.S. Senate approved a $90-million [[pilot]] [[project]] last year that would have involved about 10,000 cars.","The U.S. Senate approved a $90-million [[pi‭⁦‮⁦o⁩⁦l⁩‬⁩‬t]] [[‭⁦‮⁦r⁩⁦p⁩‬⁩‬oject]] last year that would have involved about 10,000 cars.",31,128,"L'an dernier, le Sénat américain a approuvé un projet pilote de 90 millions de dollars qui aurait porté sur environ 10 000 voitures.","Le Sénat des États-Unis a approuvé l'an dernier un projet de 90 millions de dollars portant sur environ 10 000 voitures. Ce projet de loi a été approuvé par le Sénat des États-Unis l'an dernier.","Le Sénat américain a approuvé un projet pilote de 90 M$ l'année dernière qui aurait porté sur environ 10 000 voitures.",44,"Failed"
"[[But]] the House leadership killed [[the]] [[proposal,]] acting on concerns of rural lawmakers representing constituents whose daily lives often involve logging lots of miles to get to work or into town.","[[‭⁦‮⁦u⁩⁦B⁩‬⁩‬t]] the House leadership killed [[th‭⁦‮⁦]] [[⁩⁦e⁩‬⁩‬proposal,]] acting on concerns of rural lawmakers representing constituents whose daily lives often involve logging lots of miles to get to work or into town.",82,199,"Mais les dirigeants de la Chambre ont mis fin à la proposition, répondant aux préoccupations des législateurs ruraux représentant les électeurs dont la vie quotidienne implique souvent d'abattre de nombreux kilomètres pour se rendre au travail ou en ville.",""""" """" """" """" """" """" """" """" """" """" """" """" """" """" """" """" """" """" """" """" """" """" """" """" """" """" """" """" """" """" """" """" """" """"","Mais la présidence de la Chambre a tué la proposition, répondant aux préoccupations des législateurs ruraux représentant des électeurs qui doivent parcourir de nombreux miles tous les jours pour se rendre à leur travail ou en ville.",44,"Failed"
"Several states and cities are [[nonetheless]] [[moving]] ahead on their own.","Several states and cities are [[non‭⁦‮⁦t⁩⁦e⁩‬⁩‬heless]] [[‭⁦‮⁦o⁩⁦m⁩‬⁩‬ving]] ahead on their own.",35,172,"Plusieurs États et villes progressent néanmoins d'eux-mêmes.","Plusieurs Etats et villes ne sont pas membres du Conseil de l'Europe et ne sont pas membres du Conseil de l'Europe. Plusieurs Etats et villes sont membres du Conseil de l'Europe et ne sont pas membres du Conseil de l'Europe.","Plusieurs États et grandes villes font néanmoins des progrès de leur côté.",44,"Failed"
"The most eager is [[Oregon,]] which is enlisting 5,000 drivers in the [[country's]] biggest experiment.","The most eager is [[O‭⁦‮⁦e⁩⁦r⁩‬⁩‬gon,]] which is enlisting 5,000 drivers in the [[c‭⁦‮⁦u⁩⁦o⁩‬⁩‬ntry's]] biggest experiment.",52,144,"Le plus enthousiaste est l'Oregon, qui recrute 5 000 conducteurs dans le cadre de la plus grande expérience du pays.","Le plus enthousiaste est gon, qui recrute 5 000 pilotes dans la plus grande expé rience de l ""équipe. Le plus enthousiaste est gon, qui recrute 5 000 pilotes dans la plus grande expé rience de l"" équipe.","Le plus déterminé est l'Oregon, qui a mobilisé 5 000 conducteurs pour mener l'expérience la plus importante du pays.",44,"Failed"
"Those drivers will soon pay the mileage fees [[instead]] [[of]] gas taxes to the [[state.]]","Those drivers will soon pay the mileage fees [[instead‭⁦‮⁦o⁩⁦]] [[⁩‬⁩‬f]] gas taxes to the [[st‭⁦‮⁦t⁩⁦a⁩‬⁩‬e.]]",22,148,"Ces conducteurs paieront bientôt à l ""État les frais de kilométrage au lieu des taxes sur l'essence.","Ces conducteurs paieront bientôt les taxes sur le kilométrage au lieu des taxes sur l'essence au premier kilomètre, à l'exception des taxes sur l'essence au premier kilomètre et des taxes sur l'essence au deuxième kilomètre.","Ces automobilistes paieront bientôt à l'État des frais kilométriques au lieu des taxes sur l'essence.",44,"Failed"
"[[Nevada]] [[has]] already completed a pilot.","[[N‭⁦‮⁦v⁩⁦e⁩‬⁩‬ada‭⁦‮⁦h⁩⁦]] [[⁩‬⁩‬as]] already completed a pilot.",10,128,"Le Nevada a déjà terminé un projet pilote.","Le projet pilote a déjà été mené à bien, mais il reste encore beaucoup à faire, notamment en ce qui concerne la mise en place d'un système de gestion de la qualité.","Le Nevada a déjà mené à terme un projet pilote.",44,"Failed"
"[[New]] [[York]] City is looking into one.","[[‭⁦‮⁦e⁩⁦N⁩‬⁩‬w]] [[Y‭⁦‮⁦r⁩⁦o⁩‬⁩‬k]] City is looking into one.",17,118,"La ville de New York envisage d'en adopter une.","La ville examine actuellement la possibilité de créer un centre d'information sur les droits de l'homme dans le cadre de la Convention de Genève.","La ville de New York en envisage un.",44,"Failed"
"Illinois is [[trying]] it on a limited basis [[with]] trucks.","Illinois is [[try‭⁦‮⁦n⁩⁦i⁩‬⁩‬g]] it on a limited basis [[w‭⁦‮⁦t⁩⁦i⁩‬⁩‬h]] trucks.",23,158,"L'Illinois l'essaie sur une base limitée avec des camions.","L'Illinois est un pays où l'on tente de mettre en place un système limité de transport de marchandises par camion. L'Illinois est un pays où l'on tente de mettre en place un système de transport par camion.","L'Illinois tente un essai sur un nombre limité de camions.",44,"Failed"
"And the I-95 Coalition, which includes 17 state [[transportation]] [[departments]] along the Eastern Seaboard (including Maryland, Pennsylvania, Virginia and Florida), is studying how they could go about implementing the change.","And the I-95 Coalition, which includes 17 state [[tr‭⁦‮⁦n⁩⁦a⁩‬⁩‬sportation]] [[departm‭⁦‮⁦n⁩⁦e⁩‬⁩‬ts]] along the Eastern Seaboard (including Maryland, Pennsylvania, Virginia and Florida), is studying how they could go about implementing the change.",79,182,"Et la Coalition I-95, qui comprend 17 services de transport d'État le long de la côte est (y compris le Maryland, la Pennsylvanie, la Virginie et la Floride), étudie comment ils pourraient procéder pour mettre en œuvre le changement.","Et la Coalition I-95, qui comprend 17 États, étudie comment ils pourraient procéder pour mettre en œuvre le changement. La Coalition I-95, qui comprend 17 États, examine la possibilité de créer des ministères, dont le Maryland, la Pennsylvanie, la Virginie et la Floride.","Et la coalition I-95, qui comprend 17 agences impliquées dans le transport routier dans des États longeant la côte est américaine (comprenant le Maryland, la Pennsylvanie, la Virginie et la Floride) étudie comment elle pourrait mettre en œuvre le changement.",44,"Failed"
"The concept is not a [[universal]] hit.","The concept is not a [[‭⁦‮⁦i⁩⁦‭⁦‮⁦n⁩⁦u⁩‬⁩‬⁩‬⁩‬versal]] hit.",0,128,"Le concept n'est pas un succès universel.","Il ne s'agit pas d'un terme générique, mais plutôt d'un terme générique qui désigne une situation dans laquelle un événement se produit à un moment donné.","Le concept n'est pas un succès universel.",44,"Failed"
"In Nevada, where [[about]] 50 volunteers' cars were equipped with the devices not long ago, [[drivers]] were uneasy about the government being able to monitor their every move.","In Nevada, where [[‭⁦‮⁦b⁩⁦a⁩‬⁩‬out]] 50 volunteers' cars were equipped with the devices not long ago, [[drive‭⁦‮⁦s⁩⁦r⁩‬⁩‬]] were uneasy about the government being able to monitor their every move.",118,228,"Au Nevada, où une cinquantaine de voitures de volontaires étaient équipées de ces dispositifs il n'y a pas si longtemps, les conducteurs ne voyaient pas d'un bon œil que le gouvernement puisse surveiller leurs déplacements.","Au Nevada, où 50 voitures de volontaires ont été équipées de ces dispositifs il n'y a pas si longtemps, conduire, c'est-à-dire conduire, c'est-à-dire conduire, c'est-à-dire conduire, c'est-à-dire conduire, c'est-à-dire conduire, c'est-à-dire conduire, c'est-à-dire conduire, c'est-à-dire conduire, c'est-à-dire conduire.","Dans le Nevada, où environ 50 automobilistes volontaires ont récemment équipé leur voiture d'un appareil, les conducteurs étaient inquiets que le gouvernement puisse suivre leurs moindres faits et gestes.",44,"Failed"
"[[""Concerns]] [[about]] Big Brother and those sorts of things were a major problem,"" said Alauddin Khan, who directs strategic and performance management at the Nevada Department of [[Transportation.]]","[[""Concerns‭⁦‮⁦a⁩⁦]] [[⁩‬⁩‬bout]] Big Brother and those sorts of things were a major problem,"" said Alauddin Khan, who directs strategic and performance management at the Nevada Department of [[T‭⁦‮⁦a⁩⁦r⁩‬⁩‬nsportation.]]",65,246,"""Les préoccupations au sujet de Big Brother et de ce genre de choses constituaient un problème majeur"", a déclaré Alauddin Khan, qui dirige la gestion stratégique et la gestion du rendement au ministère des Transports du Nevada.","""Des préoccupations"", dit Alauddin Khan, qui dirige la gestion stratégique et de la performance au Nevada Department of Technology, ""des préoccupations"", ""des préoccupations"", ""des préoccupations"", ""des préoccupations"", ""des préoccupations"", ""des préoccupations"", ""des préoccupations"", ""des préoccupations"", ""des préoccupations"".","« Les inquiétudes au sujet de Big Brother et ce genre de choses sont un gros problème », a déclaré Alauddin Khan, qui dirige la gestion stratégique de la performance au département des Transports du Nevada.",44,"Failed"
"It was not something [[people]] [[wanted.]]","It was not something [[peopl‭⁦‮⁦]] [[⁩⁦e⁩‬⁩‬wante‭⁦‮⁦.⁩⁦d⁩‬⁩‬]]",18,104,"Ce n'était pas ce que les gens voulaient.","Ce n ""était pas quelque chose qui n"" était pas seulement quelque chose qui n ""était pas nouveau, mais aussi quelque chose qui n"" était pas nouveau.","Ce n'est pas quelque chose que les gens veulent.",44,"Failed"
"As the trial got underway, the ACLU of [[Nevada]] warned on its [[website:]] ""It would be fairly easy to turn these devices into full-fledged tracking devices.""","As the trial got underway, the ACLU of [[Ne‭⁦‮⁦a⁩⁦v⁩‬⁩‬da]] warned on its [[webs‭⁦‮⁦t⁩⁦i⁩‬⁩‬e:]] ""It would be fairly easy to turn these devices into full-fledged tracking devices.""",77,197,"Alors que l'essai était en cours, l'ACLU du Nevada a mis en garde sur son site Web : ""Il serait assez facile de transformer ces dispositifs en dispositifs de suivi à part entière"".","Au fur et à mesure du déroulement du procès, l'ACLU de Ne Sat Sat Sat Sat Sat Sat Sat Sat Sat Sat Sat Sat Sat Sat Sat Sat Sat Sat Sat Sat Sat Sat Sat Sat Sat Sat Sat Sat Sat Sat Sat Sat Sat Sat Sat Sat Sat Sat Sat Sat Sat Sat Sat Sat Sat Sat Sat Sat Sat Sat Sat.","Dès le début de l'essai, l'ACLU du Nevada avertissait sur son site : « Ce serait relativement facile de transformer ces appareils en dispositifs de localisation à part entière. »",44,"Failed"
"There is no need to build an enormous, unwieldy technological infrastructure that will [[inevitably]] be expanded to keep records of individuals' everyday comings and [[goings.]]","There is no need to build an enormous, unwieldy technological infrastructure that will [[inevit‭⁦‮⁦b⁩⁦a⁩‬⁩‬ly]] be expanded to keep records of individuals' everyday comings and [[goin‭⁦‮⁦s⁩⁦g⁩‬⁩‬.]]",36,238,"Il n'est pas nécessaire de construire une infrastructure technologique énorme et lourde qui sera inévitablement élargie pour enregistrer les allées et venues quotidiennes des individus.","Il n'est pas nécessaire de construire une infrastructure technologique énorme et lourde qui ne sera pas nécessairement enrichie pour enregistrer les déplacements et les déplacements quotidiens des individus. Il n'est pas nécessaire de construire une infrastructure technologique énorme et compliquée qui ne sera pas nécessairement enrichie pour enregistrer les déplacements quotidiens des individus.","Il n'est pas nécessaire de construire une infrastructure technologique énorme et encombrante qui sera inévitablement élargie pour conserver les enregistrements des allées et venues quotidiennes des gens.",44,"Failed"
"[[Nevada]] [[is]] among several states now scrambling to find affordable technology that would allow the state to keep track of how many miles a car is [[being]] driven, but not exactly where and at what time.","[[Nevada‭⁦‮⁦i⁩⁦]] [[⁩‬⁩‬s]] among several states now scrambling to find affordable technology that would allow the state to keep track of how many miles a car is [[bei‭⁦‮⁦g⁩⁦n⁩‬⁩‬]] driven, but not exactly where and at what time.",78,186,"Le Nevada est l'un des États qui se démènent actuellement pour trouver une technologie abordable qui permettrait à l'État de suivre le nombre de kilomètres parcourus par une voiture, mais pas exactement où ni à quel moment.","Nevada - - - - - - - - - - - - - - - - - - - - - - - - - - - - - - - - - - - - - -","Le Nevada fait partie des quelques États qui se démènent désormais pour trouver une technologie abordable qui permettrait à l'État de savoir combien de miles parcourt une voiture, mais sans connaître le lieu ni l'heure exacts.",44,"Failed"
"If you can do that, [[Khan]] said, the public gets more [[comfortable.]]","If you can do that, [[K‭⁦‮⁦a⁩⁦h⁩‬⁩‬n]] said, the public gets more [[com‭⁦‮⁦o⁩⁦f⁩‬⁩‬rtable.]]",34,146,"Si vous pouvez le faire, dit Khan, le public se sentira plus à l'aise.","Si vous pouvez le faire, vous obtiendrez un tableau plus complet de ce que fait le public à ce sujet. Si vous pouvez le faire, vous obtiendrez un tableau plus complet de ce que fait le public.","Si on peut faire ça, a ajouté Khan, les citoyens seront plus à l'aise.",44,"Failed"
