"original_text","perturbed_text","original_score","perturbed_score","original_output","perturbed_output","ground_truth_output","num_queries","result_type"
"[[Spectacular]] [[Wingsuit]] Jump Over Bogota","[[Spec‭⁦‮⁦a⁩⁦t⁩‬⁩‬cular]] [[Win‭⁦‮⁦s⁩⁦g⁩‬⁩‬uit]] Jump Over Bogota",26,99,"Spectaculaire combinaison pour les ailes sauter au-dessus de Bogota","Saut par-dessus Bogota Saut par-dessus Bogota Saut par-dessus Bogota Saut par-dessus Bogota Saut par-dessus Bogota Saut par-dessus Bogota","Spectaculaire saut en ""wingsuit"" au-dessus de Bogota",44,"Failed"
"[[Sportsman]] Jhonathan Florez jumped from a helicopter above Bogota, the [[capital]] of Colombia, on Thursday.","[[‭⁦‮⁦p⁩⁦S⁩‬⁩‬ortsman]] Jhonathan Florez jumped from a helicopter above Bogota, the [[‭⁦‮⁦a⁩⁦c⁩‬⁩‬pital]] of Colombia, on Thursday.",19,231,"Le sportif Jhonathan Florez a sauté d'un hélicoptère au-dessus de Bogota, la capitale de la Colombie, jeudi.","A l'occasion de la Journée mondiale de la propriété intellectuelle, le directeur général de l'OMPI, M. Kamil Idris, s'est entretenu avec le directeur général de l'Organisation des Nations Unies, M. Kamil Idris, et le directeur général de l'Organisation des Nations Unies, M. Kofi Annan.","Le sportif Jhonathan Florez a sauté jeudi d'un hélicoptère au-dessus de Bogota, la capitale colombienne.",44,"Failed"
"[[Wearing]] a [[wingsuit,]] he flew past over the famous Monserrate Sanctuary at 160km/h. The sanctuary is located at an altitude of over 3000 meters and numerous spectators had gathered there to watch his exploit.","[[‭⁦‮⁦e⁩⁦W⁩‬⁩‬aring]] a [[w‭⁦‮⁦n⁩⁦i⁩‬⁩‬gsuit,]] he flew past over the famous Monserrate Sanctuary at 160km/h. The sanctuary is located at an altitude of over 3000 meters and numerous spectators had gathered there to watch his exploit.",108,191,"Vêtu d'un costume d'aile, il a survolé le célèbre sanctuaire de Monserrate à 160 km / h. Le sanctuaire est situé à plus de 3000 mètres d'altitude et de nombreux spectateurs s'y étaient rassemblés pour assister à son exploit.","A une altitude de plus de 3000 mètres, il a survolé le fameux Sanctuaire des Monserrates, où de nombreux spectateurs s ""étaient rassemblés pour assister à son exploit. Le sanctuaire se trouve à une altitude de plus de 3000 mètres.","Equipé d'un wingsuit (une combinaison munie d'ailes), il est passé à 160 km/h au-dessus du célèbre sanctuaire Monserrate, situé à plus de 3 000 mètres d'altitude, où de nombreux badauds s'étaient rassemblés pour observer son exploit.",44,"Failed"
"A [[black]] [[box]] in [[your]] car?","A [[blac‭⁦‮⁦]] [[⁩⁦k⁩‬⁩‬box]] in [[‭⁦‮⁦o⁩⁦y⁩‬⁩‬ur]] car?",1,111,"Une boîte noire dans votre voiture ?","A b l a a c a c a c a c a c a c a c a c a c a c a c a c a c a c a c a c a c a c a c a c a c a c a c a c a c a c a c a","Une boîte noire dans votre voiture ?",44,"Failed"
"As [[America's]] road planners struggle to find the cash to mend a crumbling highway system, many are beginning to see a solution in a little black [[box]] [[that]] fits neatly by the dashboard of your car.","As [[A‭⁦‮⁦e⁩⁦m⁩‬⁩‬rica's]] road planners struggle to find the cash to mend a crumbling highway system, many are beginning to see a solution in a little black [[box‭⁦‮⁦t⁩⁦]] [[⁩‬⁩‬hat]] fits neatly by the dashboard of your car.",114,231,"Alors que les planificateurs routiers américains s'efforcent de trouver l'argent nécessaire pour réparer un système routier en délabrement, beaucoup commencent à voir une solution dans une petite boîte noire qui s'adapte parfaitement au tableau de bord de votre voiture.","En tant qu ""élément constitutif d'un système routier en délabrement, beaucoup commencent à voir une solution dans une petite boîte noire. Les planificateurs de routes luttent pour trouver l'argent nécessaire pour réparer un système routier en délabrement, beaucoup commencent à voir une solution dans une petite boîte noire.","Alors que les planificateurs du réseau routier des États-Unis ont du mal à trouver l'argent nécessaire pour réparer l'infrastructure autoroutière en décrépitude, nombreux sont ceux qui entrevoient une solution sous forme d'une petite boîte noire qui se fixe au-dessus du tableau de bord de votre voiture.",44,"Failed"
"The devices, which track every mile a motorist drives and transmit that information to bureaucrats, are at the center of a controversial [[attempt]] in Washington and state planning offices to overhaul the [[outdated]] system for funding America's major roads.","The devices, which track every mile a motorist drives and transmit that information to bureaucrats, are at the center of a controversial [[a‭⁦‮⁦t⁩⁦t⁩‬⁩‬empt]] in Washington and state planning offices to overhaul the [[outda‭⁦‮⁦e⁩⁦t⁩‬⁩‬d]] system for funding America's major roads.",95,178,"Ces dispositifs, qui suivent chaque kilomètre parcouru par un automobiliste et transmettent cette information aux bureaucrates, sont au centre d'une tentative controversée à Washington et dans les bureaux de planification de l ""État visant à réviser le système désuet de financement des grands axes routiers américains.","Les dispositifs, qui suivent chaque kilomètre parcouru par un automobiliste et transmettent cette information aux bureaucrates, sont au centre d'un système controversé de financement des grands axes routiers des États-Unis. Ils sont utilisés par les bureaux de planification de Washington et de l ""État pour remettre en état les routes.","Les appareils, qui enregistrent tous les miles parcourus par un automobiliste et transmettent les informations aux fonctionnaires, sont au centre d'une tentative controversée à Washington et dans les bureaux gouvernementaux de la planification de remanier le système obsolète de financement des principales routes américaines.",44,"Failed"
"The usually [[dull]] [[arena]] [[of]] [[highway]] planning has suddenly spawned intense debate and colorful alliances.","The usually [[dull‭⁦‮⁦a⁩⁦]] [[⁩‬⁩‬rena]] [[of‭⁦‮⁦h⁩⁦]] [[⁩‬⁩‬ighway]] planning has suddenly spawned intense debate and colorful alliances.",69,151,"L'arène généralement terne de la planification routière a soudainement donné lieu à d'intenses débats et à des alliances colorées.","La planification a soudainement donné lieu à un débat intense et à des alliances très colorées. La planification est un processus complexe et complexe, qui nécessite des ressources humaines et financières considérables.","Le secteur généralement sans intérêt de la planification des grands axes a soudain provoqué un débat fort animé et des alliances mouvementées.",44,"Failed"
"[[Libertarians]] have joined environmental groups in lobbying to allow [[government]] to use the little boxes to keep track of the miles you drive, and possibly where you drive them - then use the information to draw up a tax bill.","[[Libe‭⁦‮⁦t⁩⁦r⁩‬⁩‬arians]] have joined environmental groups in lobbying to allow [[gover‭⁦‮⁦m⁩⁦n⁩‬⁩‬ent]] to use the little boxes to keep track of the miles you drive, and possibly where you drive them - then use the information to draw up a tax bill.",123,265,"Les libertaires se sont joints à des groupes environnementaux pour faire pression sur le gouvernement afin qu'il utilise les petites boîtes pour faire le suivi des kilomètres parcourus, et peut-être même de l'endroit où vous les conduisez - puis qu'il utilise l'information pour rédiger une facture fiscale.","Libe - - - - - - - - - - - - - - - - - - - - - - - - - - - - - - - -","Les libertaires ont rejoint des groupes écologistes pour faire pression afin que le gouvernement utilise les petites boîtes pour garder la trace des miles que vous parcourez, et éventuellement de la route sur laquelle vous circulez, puis utiliser les informations pour rédiger un projet de loi fiscal.",44,"Failed"
"The [[tea]] [[party]] is [[aghast.]]","The [[tea‭⁦‮⁦p⁩⁦]] [[⁩‬⁩‬arty]] is [[ag‭⁦‮⁦a⁩⁦h⁩‬⁩‬st.]]",17,154,"La fête du thé est effrayée.","Le taux de change du dollar canadien par rapport au dollar américain s'est établi en dollars américains, en dollars américains, en dollars canadiens et en dollars américains.","Le Tea Party est atterré.",44,"Failed"
"The American [[Civil]] Liberties Union is deeply [[concerned,]] too, raising a variety of privacy issues.","The American [[‭⁦‮⁦i⁩⁦C⁩‬⁩‬vil]] Liberties Union is deeply [[conce‭⁦‮⁦n⁩⁦r⁩‬⁩‬ed,]] too, raising a variety of privacy issues.",40,222,"L'American Civil Liberties Union est elle aussi profondément préoccupée par diverses questions de protection de la vie privée.","L'Union des Libertés des États-Unis est profondément convaincue que la protection de la vie privée est également une question qui se pose dans bien des domaines. En effet, l'Union des Libertés des États-Unis est profondément convaincue que la protection de la vie privée est une question complexe et complexe.","L'American Civil Liberties Union est elle aussi très préoccupée et exprime son inquiétude concernant la protection de la vie privée.",44,"Failed"
"And while [[Congress]] can't agree on [[whether]] to proceed, several states are not waiting.","And while [[C‭⁦‮⁦n⁩⁦o⁩‬⁩‬gress]] can't agree on [[wheth‭⁦‮⁦r⁩⁦e⁩‬⁩‬]] to proceed, several states are not waiting.",77,159,"Et même si le Congrès ne parvient pas à s'entendre sur l'opportunité d'aller de l'avant, plusieurs États n'attendent pas.","Même si les États ne peuvent s'entendre sur le point de savoir pourquoi ils doivent procéder, plusieurs États n'attendent pas. Les États-Unis et le Royaume-Uni n'ont pas d'accord sur le point de savoir comment procéder.","Et tandis que les membres du Congrès n'arrivent pas à se mettre d'accord pour savoir s'il faut continuer, plusieurs États n'ont pas attendu.",44,"Failed"
"They are exploring how, over the next decade, they can move [[to]] [[a]] system in which [[drivers]] pay per mile of road they roll over.","They are exploring how, over the next decade, they can move [[t‭⁦‮⁦]] [[⁩⁦o⁩‬⁩‬a]] system in which [[dri‭⁦‮⁦e⁩⁦v⁩‬⁩‬rs]] pay per mile of road they roll over.",58,230,"Ils étudient comment, au cours de la prochaine décennie, ils pourraient passer à un système dans lequel les conducteurs paieraient le kilomètre de route qu'ils roulent.","Ils étudient comment, au cours de la prochaine décennie, ils pourraient faire progresser un système dans lequel ils paieraient pour chaque kilomètre de route qu'ils rouleraient. Ils étudient aussi comment, au cours de la prochaine décennie, ils pourraient faire progresser un système dans lequel ils paieraient pour chaque kilomètre de route qu'ils rouleraient.","Ils cherchent comment, au cours de la prochaine décennie, ils pourront passer à un système permettant aux conducteurs de payer en fonction du nombre de miles parcourus.",44,"Failed"
"Thousands of [[motorists]] have already taken the black boxes, some of which have GPS [[monitoring,]] for a test drive.","Thousands of [[motori‭⁦‮⁦t⁩⁦s⁩‬⁩‬s]] have already taken the black boxes, some of which have GPS [[mon‭⁦‮⁦t⁩⁦i⁩‬⁩‬oring,]] for a test drive.",45,173,"Des milliers d'automobilistes ont déjà pris les boîtes noires, dont certaines sont équipées d'un système de surveillance GPS, pour un essai routier.","Des milliers de conducteurs ont déjà pris les boîtes noires, dont certaines sont équipées d'un GPS, pour un essai de conduite. Il s'agit de milliers de véhicules motorisés, dont des milliers de véhicules équipés d'un GPS, et de milliers de véhicules équipés d'un GPS.","Des milliers d'automobilistes ont déjà embarqué ces boîtes noires, parfois équipées d'un système de surveillance par GPS, pour une virée expérimentale.",44,"Failed"
"This [[really]] is a must for [[our]] [[nation.]]","This [[real‭⁦‮⁦y⁩⁦l⁩‬⁩‬]] is a must for [[ou‭⁦‮⁦]] [[⁩⁦r⁩‬⁩‬nation.]]",15,151,"C'est vraiment une nécessité pour notre nation.","Ce pays est indispensable à toute nation qui souhaite devenir membre de l'Organisation mondiale du commerce (OMC), en particulier en ce qui concerne les droits de propriété intellectuelle.","Cela est vraiment indispensable pour notre nation.",44,"Failed"
"""It is not a matter of something we might choose to do,"" said [[Hasan]] Ikhrata, executive director of the Southern California Assn. of Governments, which is planning for the state to start tracking miles driven by every [[California]] [[motorist]] by 2025.","""It is not a matter of something we might choose to do,"" said [[Ha‭⁦‮⁦a⁩⁦s⁩‬⁩‬n]] Ikhrata, executive director of the Southern California Assn. of Governments, which is planning for the state to start tracking miles driven by every [[California‭⁦‮⁦m⁩⁦]] [[⁩‬⁩‬otorist]] by 2025.",72,221,"""Il ne s'agit pas de quelque chose que nous pourrions choisir de faire"", a déclaré Hasan Ikhrata, directeur exécutif de la Southern California Association of Governments, qui prévoit que l ""État commencera à suivre les kilomètres parcourus par chaque automobiliste californien d'ici 2025.","""Il ne s'agit pas de quelque chose que nous pourrions choisir de faire"", a déclaré M. Hahn, qui prévoit que l ""État commence à suivre les kilomètres parcourus par tous les otoristes californiens d'ici 2025. Il s'agit d'Ikhrata, directeur exécutif de la Southern California Association of Governments.","« Ce n'est pas comme si nous avions le choix », a déclaré Hasan Ikhrata, directeur général de la Southern California Association of Governments, qui prévoit que l'État commence à enregistrer les miles parcourus par chaque automobiliste californien d'ici 2025.",44,"Failed"
"There is [[going]] to be a [[change]] in how we pay these taxes.","There is [[g‭⁦‮⁦i⁩⁦o⁩‬⁩‬ng]] to be a [[chan‭⁦‮⁦e⁩⁦g⁩‬⁩‬]] in how we pay these taxes.",14,190,"Il y aura un changement dans la façon dont nous payons ces impôts.","Il y a plusieurs façons de payer l'impôt sur le revenu des particuliers : par exemple, en payant l'impôt sur le revenu des particuliers ; en payant l'impôt sur le revenu des particuliers ; en payant l'impôt sur le revenu des particuliers.","Il va y avoir du changement dans la façon dont nous payons ces taxes.",44,"Failed"
"The [[technology]] is [[there]] to do it.","The [[‭⁦‮⁦e⁩⁦t⁩‬⁩‬chnology]] is [[th‭⁦‮⁦r⁩⁦e⁩‬⁩‬e]] to do it.",0,161,"La technologie est là pour le faire.","La chnologie est un domaine dans lequel il est possible de faire des recherches et de faire des recommandations. La chnologie est un domaine dans lequel il est possible de faire des recherches.","La technologie est là pour le faire.",44,"Failed"
"[[The]] push comes as the country's Highway Trust Fund, [[financed]] with taxes Americans pay at the gas pump, is broke.","[[‭⁦‮⁦h⁩⁦T⁩‬⁩‬e]] push comes as the country's Highway Trust Fund, [[fin‭⁦‮⁦n⁩⁦a⁩‬⁩‬ced]] with taxes Americans pay at the gas pump, is broke.",42,189,"L'impulsion vient alors que le Highway Trust Fund du pays, financé par les impôts que les Américains paient à la pompe à essence, est en panne.","L ""état de préparation du Canada sur les plans de la sécurité et de la protection de l'environnement s'est amélioré au cours de la dernière décennie, grâce à la mise en place d'un système de gestion de la sécurité et de la protection de l'environnement (SGE).","La pression vient du fait que le Highway Trust Fund du pays, financé avec les taxes que les Américains paient à la pompe, est financièrement à sec.",44,"Failed"
"[[Americans]] [[don't]] buy as much gas as they used to.","[[Ameri‭⁦‮⁦a⁩⁦c⁩‬⁩‬ns]] [[d‭⁦‮⁦n⁩⁦o⁩‬⁩‬'t]] buy as much gas as they used to.",5,164,"Les Américains n'achètent plus autant d'essence qu'auparavant.","Les émissions de gaz à effet de serre résultant de l'utilisation de combustibles fossiles pour la production d ""électricité, de chaleur et d"" électricité sont calculées à l'aide de la formule suivante :","Les Américains n'achètent plus autant d'essence qu'avant.",44,"Failed"
"Cars get [[many]] more [[miles]] to the gallon.","Cars get [[m‭⁦‮⁦n⁩⁦a⁩‬⁩‬y]] more [[mil‭⁦‮⁦s⁩⁦e⁩‬⁩‬]] to the gallon.",20,172,"Les voitures ont beaucoup plus de kilomètres au gallon.","Les voitures ont un taux de rendement plus élevé, tandis que les voitures ont un taux de rendement plus élevé. Les voitures ont un taux de rendement plus élevé, tandis que les voitures ont un taux de rendement plus élevé.","Les voitures peuvent parcourir plus de miles avec un gallon.",44,"Failed"
"The federal tax itself, 18.4 [[cents]] per gallon, hasn't gone up in [[20]] years.","The federal tax itself, 18.4 [[ce‭⁦‮⁦t⁩⁦n⁩‬⁩‬s]] per gallon, hasn't gone up in [[‭⁦‮⁦0⁩⁦2⁩‬⁩‬]] years.",20,136,"L'impôt fédéral lui-même, qui est de 18,4 cents le gallon, n'a pas augmenté en 20 ans.","L'impôt fédéral lui-même, soit 18,4 %, n'a pas augmenté en fonction du nombre d'années d'imposition. L'impôt fédéral proprement dit, soit 18,4 %, n'a pas augmenté en fonction du nombre d'années.","La taxe fédérale elle-même, qui est de 18,4 cents par gallon, n'a pas augmenté depuis 20 ans.",44,"Failed"
"[[Politicians]] are loath to raise the tax even [[one]] penny when gas prices are high.","[[Poli‭⁦‮⁦i⁩⁦t⁩‬⁩‬cians]] are loath to raise the tax even [[‭⁦‮⁦n⁩⁦o⁩‬⁩‬e]] penny when gas prices are high.",53,131,"Les politiciens répugnent à augmenter la taxe ne serait-ce que d'un sou lorsque les prix du gaz sont élevés.","Les citoyens sont réticents à l ""égard d'une hausse de la taxe, même si le prix de l'essence est élevé. Les citoyens sont réticents à l"" égard d'une hausse de la taxe même si le prix de l'essence est élevé.","Les hommes politiques sont réticents à augmenter la taxe, même d'1 cent, alors que les prix de l'essence sont élevés.",44,"Failed"
"[[""The]] [[gas]] tax is [[just]] [[not]] sustainable,"" said Lee Munnich, a transportation policy expert at the University of Minnesota.","[[""The‭⁦‮⁦g⁩⁦]] [[⁩‬⁩‬as]] tax is [[jus‭⁦‮⁦]] [[⁩⁦t⁩‬⁩‬not]] sustainable,"" said Lee Munnich, a transportation policy expert at the University of Minnesota.",13,120,"""La taxe sur l'essence n'est tout simplement pas viable"", a déclaré Lee Munnich, spécialiste des politiques de transport à l'Université du Minnesota.","Lee Munnich, expert en politique des transports à l'Université du Minnesota, a déclaré : ""Le droit fiscal est un droit, mais il n'est pas viable.","« La taxe sur l'essence n'est tout simplement pas tenable », a déclaré Lee Munnich, un spécialiste des politiques de transports à l'université du Minnesota.",44,"Failed"
"His [[state]] recently put tracking devices on 500 cars to test out a pay-by-mile [[system.]]","His [[‭⁦‮⁦t⁩⁦s⁩‬⁩‬ate]] recently put tracking devices on 500 cars to test out a pay-by-mile [[s‭⁦‮⁦s⁩⁦y⁩‬⁩‬tem.]]",29,138,"Son État a récemment installé des dispositifs de repérage sur 500 voitures pour tester un système de paiement au mille.","Sa société a récemment installé des dispositifs de repérage sur 500 voitures afin de tester un véhicule au kilomètre payant. Il s'agit de la première fois qu'un véhicule est équipé d'un dispositif de ce type.","Son État a récemment fait installer des traceurs sur 500 voitures pour tester un système de paiement au mile.",44,"Failed"
"""This works out as the most logical alternative over the long [[term,""]] [[he]] [[said.]]","""This works out as the most logical alternative over the long [[t‭⁦‮⁦r⁩⁦e⁩‬⁩‬m,""]] [[h‭⁦‮⁦]] [[⁩⁦e⁩‬⁩‬said.]]",29,127,"""Il s'agit de la solution la plus logique à long terme"", a-t-il déclaré.","""Il s'agit de la solution de rechange la plus logique par rapport à ce qui a été dit à propos de la longue période de temps qui s"" est écoulée depuis le début du projet.","« Cela s'avère être l'alternative la plus logique à long terme », a-t-il dit.",44,"Failed"
"[[Wonks]] call it a [[mileage-based]] user fee.","[[‭⁦‮⁦o⁩⁦W⁩‬⁩‬nks]] call it a [[‭⁦‮⁦i⁩⁦m⁩‬⁩‬leage-based]] user fee.",19,158,"Wonks l'appelle un frais d'utilisation basé sur le kilométrage.","Les frais d'utilisation sont calculés en fonction de l ""âge, du sexe, de l"" état matrimonial, de l ""âge, de l'origine ethnique, de la religion, de l"" état de santé et de l'orientation sexuelle.","Wonks appelle cela des frais d'utilisation au kilométrage.",44,"Failed"
"[[It]] is no surprise that the idea appeals to urban liberals, as the [[taxes]] [[could]] be rigged to change driving patterns in ways that could help reduce congestion and greenhouse gases, for example.","[[‭⁦‮⁦t⁩⁦I⁩‬⁩‬]] is no surprise that the idea appeals to urban liberals, as the [[taxe‭⁦‮⁦]] [[⁩⁦s⁩‬⁩‬could]] be rigged to change driving patterns in ways that could help reduce congestion and greenhouse gases, for example.",87,169,"Il n'est pas surprenant que cette idée plaise aux libéraux urbains, car les taxes pourraient être manipulées pour changer les habitudes de conduite de manière à réduire la congestion et les gaz à effet de serre, par exemple.","L ""élaboration d'une taxe sur les émissions de gaz à effet de serre (GES) est une étape importante dans la mise en œuvre de la stratégie de réduction de la pollution de l'air du gouvernement fédéral.","Il n'est pas surprenant que l'idée séduise les libéraux citadins, puisque les taxes pourraient servir à modifier les habitudes de conduite de manière à permettre de réduire les encombrements et les émissions de gaz, par exemple.",44,"Failed"
"California [[planners]] are looking to the system as they devise strategies to meet [[the]] [[goals]] laid out in the state's ambitious global warming laws.","California [[‭⁦‮⁦l⁩⁦p⁩‬⁩‬anners]] are looking to the system as they devise strategies to meet [[the‭⁦‮⁦g⁩⁦]] [[⁩‬⁩‬oals]] laid out in the state's ambitious global warming laws.",38,186,"Les planificateurs californiens se tournent vers le système lorsqu'ils élaborent des stratégies pour atteindre les objectifs énoncés dans les ambitieuses lois de l'État sur le réchauffement climatique.","Californie....................................","Les planificateurs de Californie s'intéressent au système puisqu'ils élaborent des stratégies pour atteindre les objectifs fixés dans les lois ambitieuses de l'État sur le réchauffement climatique.",44,"Failed"
"But Rep. Bill Shuster (R-Pa.), chairman of the House Transportation Committee, has [[said]] he, [[too,]] sees it as the most viable long-term alternative.","But Rep. Bill Shuster (R-Pa.), chairman of the House Transportation Committee, has [[s‭⁦‮⁦i⁩⁦a⁩‬⁩‬d]] he, [[‭⁦‮⁦o⁩⁦t⁩‬⁩‬o,]] sees it as the most viable long-term alternative.",55,152,"Mais le représentant Bill Shuster (R-Pa.), président du Comité des transports de la Chambre, a dit qu'il considérait lui aussi qu'il s'agissait de la solution la plus viable à long terme.","Bill Shuster (R-Pa.), président du Comité des transports de la Chambre des communes, estime toutefois que c'est la solution la plus viable à long terme. En effet, le président du Comité des transports de la Chambre des communes, Bill Shuster (R-Pa.)","Mais le représentant Bill Shuster (R-Pa.), président du Comité des transports de la Chambre des représentants, a déclaré qu'il le considérait aussi comme l'alternative la plus viable à long terme.",44,"Failed"
"The free [[marketeers]] at the Reason [[Foundation]] are also fond of having drivers pay per mile.","The free [[markete‭⁦‮⁦r⁩⁦e⁩‬⁩‬s]] at the Reason [[‭⁦‮⁦o⁩⁦F⁩‬⁩‬undation]] are also fond of having drivers pay per mile.",71,162,"Les libéraux de la Reason Foundation adorent également que les chauffeurs paient le kilomètre.","Le libre-échangiste (free markete) L ""échange (free markete) L"" échange (free markete) L ""échange (free markete) L"" échange (free markete) L ""échange (free markete) L"" échange (free markete) L ""échange (free mark)","Les partisans du marché libre de la fondation Reason apprécient également l'idée de faire payer les conducteurs au mile.",44,"Failed"
