"original_text","perturbed_text","original_score","perturbed_score","original_output","perturbed_output","ground_truth_output","num_queries","result_type"
"[[Illinois]] is [[trying]] [[it]] on a limited basis [[with]] [[trucks.]]","[[‭⁦‮⁦l⁩⁦I⁩‬⁩‬lin‭⁦‮⁦i⁩⁦o⁩‬⁩‬s]] is [[trying‭⁦‮⁦i⁩⁦]] [[⁩‬⁩‬t]] on a limited basis [[with‭⁦‮⁦t⁩⁦]] [[⁩‬⁩‬ruck‭⁦‮⁦.⁩⁦s⁩‬⁩‬]]",23,334,"L'Illinois l'essaie sur une base limitée avec des camions.","À titre d'exemple, on peut citer la création d'une base de données contenant des informations sur les droits de propriété intellectuelle, les droits de propriété intellectuelle, les droits de propriété intellectuelle, les droits de propriété intellectuelle, les droits de propriété intellectuelle, les droits de propriété intellectuelle, les droits d'auteur et les droits connexes.","L'Illinois tente un essai sur un nombre limité de camions.",107,"Failed"
"And the I-95 [[Coalition,]] [[which]] [[includes]] 17 state transportation departments along the Eastern Seaboard (including Maryland, [[Pennsylvania,]] [[Virginia]] and Florida), is [[studying]] how they could go about implementing the change.","And the I-95 [[Coalition,‭⁦‮⁦w⁩⁦]] [[⁩‬⁩‬hich]] [[‭⁦‮⁦n⁩⁦i⁩‬⁩‬cludes]] 17 state transportation departments along the Eastern Seaboard (including Maryland, [[Pen‭⁦‮⁦s⁩⁦n⁩‬⁩‬ylvania,]] [[‭⁦‮⁦i⁩⁦V⁩‬⁩‬rginia]] and Florida), is [[stud‭⁦‮⁦i⁩⁦y⁩‬⁩‬ng]] how they could go about implementing the change.",79,550,"Et la Coalition I-95, qui comprend 17 services de transport d'État le long de la côte est (y compris le Maryland, la Pennsylvanie, la Virginie et la Floride), étudie comment ils pourraient procéder pour mettre en œuvre le changement.","Et la coalition I-95, qui comprend 17 services de transport d ""État le long de la côte est (y compris le Maryland, le pénis), qui comprend 17 services de transport d"" État le long de la côte est (y compris le Maryland, le pénis), qui comprend 17 services de transport d ""État (y compris le service de transport d"" État du Maryland, le service de transport d ""État du Maryland, le service de transport d"" État du Maryland, le service de transport d ""État de la Floride, le service de transport d"" État du Maryland, le service de transport d ""État du Maryland, le service de transport d"" État du Maryland, le service de transport d ""État du Maryland, le service de transport d"" État du Maryland et le service de transport d ""État de la Floride).","Et la coalition I-95, qui comprend 17 agences impliquées dans le transport routier dans des États longeant la côte est américaine (comprenant le Maryland, la Pennsylvanie, la Virginie et la Floride) étudie comment elle pourrait mettre en œuvre le changement.",107,"Failed"
"The [[concept]] is [[not]] a universal [[hit.]]","The [[c‭⁦‮⁦n⁩⁦o⁩‬⁩‬c‭⁦‮⁦p⁩⁦e⁩‬⁩‬t]] is [[‭⁦‮⁦o⁩⁦n⁩‬⁩‬t]] a universal [[h‭⁦‮⁦‭⁦‮⁦.⁩⁦t⁩‬⁩‬⁩⁦i⁩‬⁩‬]]",0,354,"Le concept n'est pas un succès universel.","L ""élaboration d'un plan d'action en faveur de l"" égalité des chances pour les femmes et les hommes est un élément essentiel de la stratégie globale de l'UE en faveur de l ""égalité des chances pour les femmes et les hommes. La mise en œuvre d'un plan d'action en faveur de l"" égalité des chances pour les femmes et les hommes constitue un élément essentiel de la stratégie globale de l'UE.","Le concept n'est pas un succès universel.",107,"Failed"
"In Nevada, where about 50 [[volunteers']] cars were [[equipped]] with the devices not [[long]] ago, drivers were uneasy about the government being able to [[monitor]] [[their]] [[every]] move.","In Nevada, where about 50 [[vo‭⁦‮⁦u⁩⁦l⁩‬⁩‬nteers']] cars were [[equip‭⁦‮⁦e⁩⁦p⁩‬⁩‬d]] with the devices not [[‭⁦‮⁦o⁩⁦l⁩‬⁩‬ng]] ago, drivers were uneasy about the government being able to [[mon‭⁦‮⁦t⁩⁦i⁩‬⁩‬or]] [[thei‭⁦‮⁦]] [[⁩⁦r⁩‬⁩‬every]] move.",118,418,"Au Nevada, où une cinquantaine de voitures de volontaires étaient équipées de ces dispositifs il n'y a pas si longtemps, les conducteurs ne voyaient pas d'un bon œil que le gouvernement puisse surveiller leurs déplacements.","Au Nevada, où une cinquantaine de voitures volantes ont été équipées de dispositifs autres que ceux qui existaient il y a une cinquantaine d'années, les conducteurs ne voyaient pas d'un bon œil que le gouvernement soit en mesure de prendre toutes les mesures nécessaires pour les mettre en œuvre. Au Nevada, où une cinquantaine de voitures volantes ont été équipées de dispositifs autres que ceux qui existaient il y a une cinquantaine d'années, les conducteurs se sentaient mal à l'aise à l'idée que le gouvernement puisse prendre chaque mesure.","Dans le Nevada, où environ 50 automobilistes volontaires ont récemment équipé leur voiture d'un appareil, les conducteurs étaient inquiets que le gouvernement puisse suivre leurs moindres faits et gestes.",107,"Failed"
"""Concerns [[about]] Big Brother and those sorts of things [[were]] [[a]] major problem,"" said [[Alauddin]] Khan, who directs strategic and [[performance]] management at the Nevada Department of [[Transportation.]]","""Concerns [[‭⁦‮⁦b⁩⁦a⁩‬⁩‬out]] Big Brother and those sorts of things [[wer‭⁦‮⁦]] [[⁩⁦e⁩‬⁩‬a]] major problem,"" said [[Alaudd‭⁦‮⁦n⁩⁦i⁩‬⁩‬]] Khan, who directs strategic and [[perfor‭⁦‮⁦a⁩⁦m⁩‬⁩‬nce]] management at the Nevada Department of [[Transpo‭⁦‮⁦t⁩⁦r⁩‬⁩‬ation.]]",65,471,"""Les préoccupations au sujet de Big Brother et de ce genre de choses constituaient un problème majeur"", a déclaré Alauddin Khan, qui dirige la gestion stratégique et la gestion du rendement au ministère des Transports du Nevada.","""Préoccupations"", dit Alaudd, ""qui dirige la gestion stratégique et pérenne du département du Nevada de Transpo"", et ""la gestion stratégique et pérenne du département du Nevada de Transpo"", tandis que ""la gestion stratégique et pérenne du département du Nevada de Transpo"", ""la gestion stratégique et pérenne du département du Nevada de Transpo"", ""la gestion stratégique et pérenne du département du Nevada de Transpo"", ""la gestion stratégique et pérenne du département du Nevada"", ""la gestion stratégique et pérenne du département du Nevada de Transpo"" et ""la gestion stratégique et pérale du département du Nevada"".","« Les inquiétudes au sujet de Big Brother et ce genre de choses sont un gros problème », a déclaré Alauddin Khan, qui dirige la gestion stratégique de la performance au département des Transports du Nevada.",107,"Failed"
"It was not [[something]] [[people]] [[wanted.]]","It was not [[somethi‭⁦‮⁦g⁩⁦n⁩‬⁩‬]] [[pe‭⁦‮⁦p⁩⁦o⁩‬⁩‬‭⁦‮⁦e⁩⁦l⁩‬⁩‬]] [[w‭⁦‮⁦n⁩⁦a⁩‬⁩‬te‭⁦‮⁦.⁩⁦d⁩‬⁩‬]]",18,462,"Ce n'était pas ce que les gens voulaient.","Ce n ""était pas quelque chose de quelque chose de quelque chose de quelque chose de quelque chose de quelque chose de quelque chose de quelque chose de quelque chose de quelque chose de quelque chose de quelque chose de quelque chose de quelque chose de quelque chose de quelque chose de quelque chose de quelque chose de quelque chose de quelque chose de quelque chose de quelque chose de quelque chose de quelque chose de quelque chose de quelque chose de quelque chose de quelque chose de semblable.","Ce n'est pas quelque chose que les gens veulent.",107,"Failed"
"As the trial got underway, the [[ACLU]] of [[Nevada]] [[warned]] on its website: ""It would [[be]] [[fairly]] [[easy]] to turn these devices into full-fledged [[tracking]] devices.""","As the trial got underway, the [[AC‭⁦‮⁦U⁩⁦L⁩‬⁩‬]] of [[Nevad‭⁦‮⁦]] [[⁩⁦a⁩‬⁩‬warned]] on its website: ""It would [[be‭⁦‮⁦f⁩⁦]] [[⁩‬⁩‬airly]] [[ea‭⁦‮⁦y⁩⁦s⁩‬⁩‬]] to turn these devices into full-fledged [[tra‭⁦‮⁦k⁩⁦c⁩‬⁩‬ing]] devices.""",77,307,"Alors que l'essai était en cours, l'ACLU du Nevada a mis en garde sur son site Web : ""Il serait assez facile de transformer ces dispositifs en dispositifs de suivi à part entière"".","Au fur et à mesure que le procès a commencé, le CA a lancé une mise en garde sur son site web : ""Il s'agirait d'une sorte de dispositif de stockage de l'air, qui transformerait ces dispositifs en dispositifs de stockage à part entière"". (traduction libre). (traduction libre) Au fur et à mesure que le procès a commencé, le CA a lancé une mise en garde sur son site web : ""Ce serait un dispositif de stockage de l'air.","Dès le début de l'essai, l'ACLU du Nevada avertissait sur son site : « Ce serait relativement facile de transformer ces appareils en dispositifs de localisation à part entière. »",107,"Failed"
"[[There]] [[is]] [[no]] [[need]] to build an [[enormous,]] unwieldy technological infrastructure that will inevitably be [[expanded]] [[to]] [[keep]] records of individuals' everyday comings and goings.","[[There‭⁦‮⁦i⁩⁦]] [[⁩‬⁩‬s]] [[n‭⁦‮⁦]] [[⁩⁦o⁩‬⁩‬need]] to build an [[enormo‭⁦‮⁦s⁩⁦u⁩‬⁩‬,]] unwieldy technological infrastructure that will inevitably be [[expand‭⁦‮⁦d⁩⁦e⁩‬⁩‬]] [[t‭⁦‮⁦]] [[⁩⁦o⁩‬⁩‬keep]] records of individuals' everyday comings and goings.",36,611,"Il n'est pas nécessaire de construire une infrastructure technologique énorme et lourde qui sera inévitablement élargie pour enregistrer les allées et venues quotidiennes des individus.","Il y a lieu de se doter d'une infrastructure technologique complexe qui ne manquera pas de s ""étendre et de prendre de l'expansion. A cette fin, il faut tenir des registres des évolutions et des événements quotidiens de chaque individu. Les registres des évolutions et des événements peuvent être consultés à l'adresse suivante : http : / / europa.eu.int / comm / employment _ social / employment _ social / employment _ social / employment _ social / employment _ social / employment _ social / employment _ social / employment _ social / employment _ social / employment _ social / employment _ social _ social _ social _ social _ economic _ social _ social _ social _ economic _ social _ economic _ social _ economic _ social _ sociality.pdf.","Il n'est pas nécessaire de construire une infrastructure technologique énorme et encombrante qui sera inévitablement élargie pour conserver les enregistrements des allées et venues quotidiennes des gens.",107,"Failed"
"[[Nevada]] is among several states now scrambling to find affordable technology that would allow the state [[to]] [[keep]] track of how many miles a car [[is]] [[being]] [[driven,]] [[but]] not exactly [[where]] and at what time.","[[Nev‭⁦‮⁦d⁩⁦a⁩‬⁩‬a]] is among several states now scrambling to find affordable technology that would allow the state [[to‭⁦‮⁦k⁩⁦]] [[⁩‬⁩‬eep]] track of how many miles a car [[i‭⁦‮⁦]] [[⁩⁦s⁩‬⁩‬being]] [[driven,‭⁦‮⁦b⁩⁦]] [[⁩‬⁩‬ut]] not exactly [[wh‭⁦‮⁦r⁩⁦e⁩‬⁩‬e]] and at what time.",78,403,"Le Nevada est l'un des États qui se démènent actuellement pour trouver une technologie abordable qui permettrait à l'État de suivre le nombre de kilomètres parcourus par une voiture, mais pas exactement où ni à quel moment.","Négligence a) Parmi plusieurs États qui s'efforcent actuellement de trouver une technologie abordable qui permettrait à l ""État de tirer profit de la distance parcourue par la voiture, on peut citer : a) le nombre de kilomètres parcourus par la voiture ; b) le nombre de kilomètres parcourus par la voiture ; c) le nombre de kilomètres parcourus par la voiture ; d) le nombre de kilomètres parcourus par la voiture ; e) le nombre de kilomètres parcourus par la voiture ; f) le nombre de kilomètres parcourus par la voiture ; g) le nombre de kilomètres parcourus.","Le Nevada fait partie des quelques États qui se démènent désormais pour trouver une technologie abordable qui permettrait à l'État de savoir combien de miles parcourt une voiture, mais sans connaître le lieu ni l'heure exacts.",107,"Failed"
"If you [[can]] do that, Khan [[said,]] the [[public]] gets more [[comfortable.]]","If you [[c‭⁦‮⁦n⁩⁦a⁩‬⁩‬]] do that, Khan [[s‭⁦‮⁦i⁩⁦a⁩‬⁩‬d,]] the [[pu‭⁦‮⁦‭⁦‮⁦i⁩⁦l⁩‬⁩‬⁩⁦b⁩‬⁩‬c]] gets more [[comf‭⁦‮⁦r⁩⁦o⁩‬⁩‬table.]]",34,488,"Si vous pouvez le faire, dit Khan, le public se sentira plus à l'aise.","Si vous avez besoin d'un tableau plus détaillé, vous pouvez le consulter à l'adresse suivante : http : / / ec.europa.eu / comm / comm / comm / comm / comm / comm / comm / comm / comm / comm / comm / comm / comm / comm / comm / comm / comm / comm / comm / comm / comm / comm / comm / comm / comm / comm / comm / comm / comm / comm / comm / comm / comm / comm / comm / comm / comm / comm / comm / comm / comm / comm / comm / comm / comm / comm / comm / comm / comm / comm / comm / comm / comm / comm / comm / comm / comm...","Si on peut faire ça, a ajouté Khan, les citoyens seront plus à l'aise.",107,"Failed"
