"original_text","perturbed_text","original_score","perturbed_score","original_output","perturbed_output","ground_truth_output","num_queries","result_type"
"`  After the wasted bit on his sexuality, I haven't read the above diatribe but one thing for ABSOLUTE certain: [[Never]] in the history of this planet has Umberto ever been referred to as Humbert. It is this kind of lunacy that renders Wikipedia as a ``fringe`` place for [[idiots]] to play. Get serious....DW`","`  After the wasted bit on his sexuality, I haven't read the above diatribe but one thing for ABSOLUTE certain: [[Nepver]] in the history of this planet has Umberto ever been referred to as Humbert. It is this kind of lunacy that renders Wikipedia as a ``fringe`` place for [[id?iots]] to play. Get serious....DW`",-1.711942195892334,-0.9355190992355347,"tensor([9.6299e-01, 1.7065e-03, 6.9568e-02, 8.5043e-04, 6.6601e-01, 1.0821e-02])","tensor([9.2278e-01, 2.7696e-04, 3.5307e-03, 1.6088e-03, 6.6493e-03, 6.7815e-04])",0,86,"Failed"
"    Erik, for crying out loud. You legally can have sex with children, but not with underage children. Underage children are children beneath the legal age of consent (different states have 14, 15, 16, 17 or 18 as the underage limit. Children in most countries means someone under the age of 18. In Ireland for example, a 'child' aged 17 is over the age of consent. In Britain it is 16. Do you know the first thing about the topic?   The name is standard english asage. Scandal is a POV term. Allegation allows the discussion of cases that have not yet come to court, which cannot for technical reasons be prosecuted and cases that were thrown up as invalid. Roman Catholic Church sex abuses allegations in standard english means allegations about the Roman Catholic Church.   Public relations is minor tabloid point when you are discussing the rape of children, so stop adding in an irrelevant topic.   Your mucking around lost a lot of changes, spelling corrections and other problems solved. I was caught in an edit [[conflict]] with you and given the scale of the changes could do nothing but a cut and paste job. I then tried to go in to your version to transfer over [[accurate]] changes but then you started this insane fucking around with the article's location, using a POV title. I will keep moving back to a carefully worded neutral title.  ","    Erik, for crying out loud. You legally can have sex with children, but not with underage children. Underage children are children beneath the legal age of consent (different states have 14, 15, 16, 17 or 18 as the underage limit. Children in most countries means someone under the age of 18. In Ireland for example, a 'child' aged 17 is over the age of consent. In Britain it is 16. Do you know the first thing about the topic?   The name is standard english asage. Scandal is a POV term. Allegation allows the discussion of cases that have not yet come to court, which cannot for technical reasons be prosecuted and cases that were thrown up as invalid. Roman Catholic Church sex abuses allegations in standard english means allegations about the Roman Catholic Church.   Public relations is minor tabloid point when you are discussing the rape of children, so stop adding in an irrelevant topic.   Your mucking around lost a lot of changes, spelling corrections and other problems solved. I was caught in an edit [[confli7ct]] with you and given the scale of the changes could do nothing but a cut and paste job. I then tried to go in to your version to transfer over [[accuratje]] changes but then you started this insane fucking around with the article's location, using a POV title. I will keep moving back to a carefully worded neutral title.  ",-1.088433027267456,-0.6846148371696472,"tensor([9.5041e-01, 1.1281e-03, 1.2786e-01, 2.0196e-03, 6.5274e-03, 4.9106e-04])","tensor([6.6675e-01, 3.2694e-04, 1.4896e-02, 8.3674e-04, 1.4711e-03, 3.3531e-04])",0,86,"Failed"
"BOOBS, BOOBS, BOOBS, BOOBS, [[BOOBS,]] BOOBS, BOOBS, BOOBS, BOOBS, BOOBS, BOOBS, BOOBS, BOOBS, BOOBS, BOOBS, BOOBS, BOOBS, BOOBS, BOOBS, BOOBS, BOOBS, BOOBS, BOOBS, BOOBS, BOOBS, BOOBS, BOOBS, BOOBS, BOOBS, BOOBS, BOOBS, BOOBS, BOOBS, BOOBS, BOOBS, BOOBS, BOOBS, BOOBS, BOOBS, BOOBS, BOOBS, BOOBS, BOOBS, BOOBS, BOOBS, BOOBS, BOOBS, BOOBS, BOOBS, BOOBS, BOOBS, BOOBS, BOOBS, BOOBS, BOOBS, BOOBS, BOOBS, BOOBS, BOOBS, BOOBS, BOOBS, BOOBS, BOOBS, BOOBS, BOOBS, BOOBS, BOOBS, BOOBS, BOOBS, BOOBS, BOOBS, BOOBS, BOOBS, BOOBS, BOOBS, BOOBS, BOOBS, BOOBS, BOOBS, BOOBS, BOOBS, BOOBS, BOOBS, BOOBS, BOOBS, BOOBS, BOOBS, BOOBS, BOOBS, BOOBS, BOOBS, BOOBS, BOOBS, BOOBS, BOOBS, BOOBS, BOOBS, BOOBS, BOOBS, BOOBS, BOOBS, BOOBS, BOOBS, BOOBS, BOOBS, BOOBS, BOOBS, BOOBS, BOOBS, BOOBS, BOOBS, BOOBS, BOOBS, BOOBS, BOOBS, BOOBS, BOOBS, BOOBS, BOOBS, BOOBS, BOOBS, BOOBS, BOOBS, BOOBS, BOOBS, BOOBS, BOOBS, BOOBS, BOOBS, BOOBS, BOOBS, BOOBS, BOOBS, BOOBS, BOOBS, BOOBS, BOOBS, BOOBS, BOOBS, BOOBS, BOOBS, BOOBS, BOOBS, BOOBS, BOOBS, BOOBS, BOOBS, BOOBS, BOOBS, BOOBS, BOOBS, BOOBS, BOOBS, BOOBS, BOOBS, BOOBS, BOOBS, BOOBS, BOOBS, BOOBS, BOOBS, BOOBS, BOOBS, BOOBS, BOOBS, BOOBS, BOOBS, BOOBS, BOOBS, BOOBS, BOOBS, BOOBS, BOOBS, BOOBS, BOOBS, BOOBS, BOOBS, BOOBS, BOOBS, BOOBS, BOOBS, BOOBS, BOOBS, BOOBS, BOOBS, BOOBS, BOOBS, BOOBS, BOOBS, BOOBS, BOOBS, BOOBS, BOOBS, BOOBS, BOOBS, BOOBS, BOOBS, BOOBS, BOOBS, BOOBS, BOOBS, BOOBS, BOOBS, BOOBS, BOOBS, BOOBS, BOOBS, BOOBS, BOOBS, BOOBS, BOOBS, BOOBS, BOOBS, BOOBS, BOOBS, BOOBS, BOOBS, BOOBS, BOOBS, BOOBS, BOOBS, BOOBS, BOOBS, BOOBS, BOOBS, BOOBS, BOOBS, BOOBS, BOOBS, BOOBS, BOOBS, BOOBS, BOOBS, BOOBS, BOOBS, BOOBS, BOOBS, BOOBS, BOOBS, BOOBS, BOOBS, BOOBS, BOOBS, BOOBS, BOOBS, BOOBS, BOOBS, BOOBS, BOOBS, BOOBS, BOOBS, BOOBS, BOOBS, BOOBS, BOOBS, BOOBS, BOOBS, BOOBS, BOOBS, BOOBS, BOOBS, BOOBS, BOOBS, BOOBS, BOOBS, BOOBS, BOOBS, BOOBS, BOOBS, BOOBS, BOOBS, BOOBS, BOOBS, BOOBS, BOOBS, BOOBS, BOOBS, BOOBS, BOOBS, BOOBS, BOOBS, BOOBS, BOOBS, BOOBS, BOOBS, BOOBS, BOOBS, BOOBS, BOOBS, BOOBS, BOOBS, BOOBS, BOOBS, [[BOOBS,]] BOOBS, BOOBS, BOOBS, BOOBS, BOOBS, BOOBS, BOOBS, BOOBS, BOOBS, BOOBS, BOOBS, BOOBS, BOOBS, BOOBS, BOOBS, BOOBS, BOOBS, BOOBS, BOOBS, BOOBS, BOOBS, BOOBS, BOOBS, BOOBS, BOOBS, BOOBS, BOOBS, BOOBS, BOOBS, BOOBS, BOOBS, BOOBS, BOOBS, BOOBS, BOOBS, BOOBS, BOOBS, BOOBS, BOOBS, BOOBS, BOOBS, BOOBS, BOOBS, BOOBS, BOOBS, BOOBS, BOOBS, BOOBS, BOOBS, BOOBS, BOOBS, BOOBS, BOOBS, BOOBS, BOOBS, BOOBS, BOOBS, BOOBS, BOOBS, BOOBS, BOOBS, BOOBS, BOOBS, BOOBS, BOOBS, BOOBS, BOOBS, BOOBS, BOOBS","BOOBS, BOOBS, BOOBS, BOOBS, [[BOOBS$,]] BOOBS, BOOBS, BOOBS, BOOBS, BOOBS, BOOBS, BOOBS, BOOBS, BOOBS, BOOBS, BOOBS, BOOBS, BOOBS, BOOBS, BOOBS, BOOBS, BOOBS, BOOBS, BOOBS, BOOBS, BOOBS, BOOBS, BOOBS, BOOBS, BOOBS, BOOBS, BOOBS, BOOBS, BOOBS, BOOBS, BOOBS, BOOBS, BOOBS, BOOBS, BOOBS, BOOBS, BOOBS, BOOBS, BOOBS, BOOBS, BOOBS, BOOBS, BOOBS, BOOBS, BOOBS, BOOBS, BOOBS, BOOBS, BOOBS, BOOBS, BOOBS, BOOBS, BOOBS, BOOBS, BOOBS, BOOBS, BOOBS, BOOBS, BOOBS, BOOBS, BOOBS, BOOBS, BOOBS, BOOBS, BOOBS, BOOBS, BOOBS, BOOBS, BOOBS, BOOBS, BOOBS, BOOBS, BOOBS, BOOBS, BOOBS, BOOBS, BOOBS, BOOBS, BOOBS, BOOBS, BOOBS, BOOBS, BOOBS, BOOBS, BOOBS, BOOBS, BOOBS, BOOBS, BOOBS, BOOBS, BOOBS, BOOBS, BOOBS, BOOBS, BOOBS, BOOBS, BOOBS, BOOBS, BOOBS, BOOBS, BOOBS, BOOBS, BOOBS, BOOBS, BOOBS, BOOBS, BOOBS, BOOBS, BOOBS, BOOBS, BOOBS, BOOBS, BOOBS, BOOBS, BOOBS, BOOBS, BOOBS, BOOBS, BOOBS, BOOBS, BOOBS, BOOBS, BOOBS, BOOBS, BOOBS, BOOBS, BOOBS, BOOBS, BOOBS, BOOBS, BOOBS, BOOBS, BOOBS, BOOBS, BOOBS, BOOBS, BOOBS, BOOBS, BOOBS, BOOBS, BOOBS, BOOBS, BOOBS, BOOBS, BOOBS, BOOBS, BOOBS, BOOBS, BOOBS, BOOBS, BOOBS, BOOBS, BOOBS, BOOBS, BOOBS, BOOBS, BOOBS, BOOBS, BOOBS, BOOBS, BOOBS, BOOBS, BOOBS, BOOBS, BOOBS, BOOBS, BOOBS, BOOBS, BOOBS, BOOBS, BOOBS, BOOBS, BOOBS, BOOBS, BOOBS, BOOBS, BOOBS, BOOBS, BOOBS, BOOBS, BOOBS, BOOBS, BOOBS, BOOBS, BOOBS, BOOBS, BOOBS, BOOBS, BOOBS, BOOBS, BOOBS, BOOBS, BOOBS, BOOBS, BOOBS, BOOBS, BOOBS, BOOBS, BOOBS, BOOBS, BOOBS, BOOBS, BOOBS, BOOBS, BOOBS, BOOBS, BOOBS, BOOBS, BOOBS, BOOBS, BOOBS, BOOBS, BOOBS, BOOBS, BOOBS, BOOBS, BOOBS, BOOBS, BOOBS, BOOBS, BOOBS, BOOBS, BOOBS, BOOBS, BOOBS, BOOBS, BOOBS, BOOBS, BOOBS, BOOBS, BOOBS, BOOBS, BOOBS, BOOBS, BOOBS, BOOBS, BOOBS, BOOBS, BOOBS, BOOBS, BOOBS, BOOBS, BOOBS, BOOBS, BOOBS, BOOBS, BOOBS, BOOBS, BOOBS, BOOBS, BOOBS, BOOBS, BOOBS, BOOBS, BOOBS, BOOBS, BOOBS, BOOBS, BOOBS, BOOBS, BOOBS, BOOBS, BOOBS, BOOBS, BOOBS, BOOBS, BOOBS, BOOBS, BOOBS, BOOBS, BOOBS, BOOBS, BOOBS, BOOBS, BOOBS, BOOBS, BOOBS, BOOBS, BOOBS, BOOBS, BOOBS, BOOBS, BOOBS, BOOBS, BOOBS, BOOBS, BOOBS, BOOBS, [[kBOOBS,]] BOOBS, BOOBS, BOOBS, BOOBS, BOOBS, BOOBS, BOOBS, BOOBS, BOOBS, BOOBS, BOOBS, BOOBS, BOOBS, BOOBS, BOOBS, BOOBS, BOOBS, BOOBS, BOOBS, BOOBS, BOOBS, BOOBS, BOOBS, BOOBS, BOOBS, BOOBS, BOOBS, BOOBS, BOOBS, BOOBS, BOOBS, BOOBS, BOOBS, BOOBS, BOOBS, BOOBS, BOOBS, BOOBS, BOOBS, BOOBS, BOOBS, BOOBS, BOOBS, BOOBS, BOOBS, BOOBS, BOOBS, BOOBS, BOOBS, BOOBS, BOOBS, BOOBS, BOOBS, BOOBS, BOOBS, BOOBS, BOOBS, BOOBS, BOOBS, BOOBS, BOOBS, BOOBS, BOOBS, BOOBS, BOOBS, BOOBS, BOOBS, BOOBS, BOOBS",-1.7318289279937744,-1.6484401226043701,"tensor([0.9890, 0.0210, 0.6732, 0.0114, 0.0362, 0.0010])","tensor([9.8792e-01, 1.6948e-02, 5.9967e-01, 1.2909e-02, 3.0018e-02, 9.7160e-04])",0,86,"Failed"
"  It was anonymous on [[accident,]] and FYI, I'm not a troll [[moron.]]  ","  It was anonymous on [[accaident,]] and FYI, I'm not a troll [[mDoron.]]  ",-0.6509863138198853,-0.0010997463250532746,"tensor([6.3730e-01, 2.2119e-04, 6.5575e-03, 2.2104e-04, 6.4976e-03, 1.8520e-04])","tensor([4.3748e-04, 1.1584e-04, 2.2408e-04, 7.9341e-05, 1.3966e-04, 1.0335e-04])",0,86,"Successful"
"a [[dippy]] [[lunatic]] like ","a [[3dippy]] [[lunatxic]] like ",-1.020289659500122,-0.0010867273667827249,"tensor([9.5362e-01, 5.9087e-04, 2.3544e-03, 2.6504e-03, 6.0207e-02, 8.6768e-04])","tensor([4.1487e-04, 1.1657e-04, 1.7669e-04, 9.2427e-05, 1.4573e-04, 1.4044e-04])",0,86,"Successful"
"[[Yes,]] complain to your rabbi and then go shoot some more defenseless [[Arabs]] to take out your frustration.    ","[[Yevs,]] complain to your rabbi and then go shoot some more defenseless [[AErabs]] to take out your frustration.    ",-2.523426055908203,-0.9889827966690063,"tensor([0.9787, 0.0508, 0.1007, 0.1988, 0.2891, 0.9054])","tensor([0.9443, 0.0013, 0.0026, 0.0208, 0.0113, 0.0088])",0,86,"Failed"
"  i am using the sandbox, [[ass]] wipe","  i am using the sandbox, [[as<$s]] wipe",-2.824984312057495,-0.0009341310360468924,"tensor([9.8629e-01, 3.5899e-02, 9.6445e-01, 7.1178e-04, 8.3451e-01, 3.1260e-03])","tensor([3.5265e-04, 9.9767e-05, 1.6308e-04, 7.0620e-05, 1.4003e-04, 1.0798e-04])",0,86,"Successful"
"  == whoa ==  you are [[a]] bi fat [[idiot,]] stop spamming my user space.","  == whoa ==  you are [[am]] bi fat [[id=iot,]] stop spamming my user space.",-2.96948504447937,-1.016297459602356,"tensor([0.9889, 0.0698, 0.9102, 0.0015, 0.9791, 0.0200])","tensor([9.7048e-01, 5.0283e-04, 6.8819e-03, 2.0793e-03, 3.5449e-02, 9.0917e-04])",0,86,"Failed"
"  == [[FUCK]] YOU THUE ==  YOU BRAIN DEAD FUCK, YOU CAN'T BLOCK ME. THANKS TO PROXY SERVERS AND ANON BROWSING I CAN COME TO WIKI ZILLION TIMES SO IF SCUM LIKE YOU THINK THAT YOU CAN BLOCK ME THEN YOU ARE IN FOR BIG SURPRISE YOU FAGGOT. I AM GIVING YOU LAST CHANCE IN CIVILIZED WAY TO STOP VANDALIZING KASH JAFFREY. DON'T FUCK WITH CANADIAN CONTENT, ITS TO ADVANCE FOR YOUR EMPTY BRAIN TO [[CONCIEVE.]] AND LASTLY IF YOU WANT TO LEAVE MESSAGE THEN WRITE (DON'T USE PREDEFINE ONE LINERS.) SEE YA ASSHOLE  JOEY","  == [[F)UCK]] YOU THUE ==  YOU BRAIN DEAD FUCK, YOU CAN'T BLOCK ME. THANKS TO PROXY SERVERS AND ANON BROWSING I CAN COME TO WIKI ZILLION TIMES SO IF SCUM LIKE YOU THINK THAT YOU CAN BLOCK ME THEN YOU ARE IN FOR BIG SURPRISE YOU FAGGOT. I AM GIVING YOU LAST CHANCE IN CIVILIZED WAY TO STOP VANDALIZING KASH JAFFREY. DON'T FUCK WITH CANADIAN CONTENT, ITS TO ADVANCE FOR YOUR EMPTY BRAIN TO [[CONCIEVED.]] AND LASTLY IF YOU WANT TO LEAVE MESSAGE THEN WRITE (DON'T USE PREDEFINE ONE LINERS.) SEE YA ASSHOLE  JOEY",-3.605079412460327,-3.5224449634552,"tensor([0.9972, 0.5847, 0.9971, 0.0080, 0.9786, 0.0395])","tensor([0.9969, 0.5195, 0.9966, 0.0065, 0.9738, 0.0291])",0,46,"Failed"
"`  :: Hey, the only persons ``suffering`` were those who read that [[bullshit,]] Wikipedia opening itself up to a Copyright infringement suit, and the credibility of those who are facilitating both.  The length of the protections will not influence my decision to revert the article back to a [[previous]] version that does not contain plagiarism.  `","`  :: Hey, the only persons ``suffering`` were those who read that [[b;ullshit,]] Wikipedia opening itself up to a Copyright infringement suit, and the credibility of those who are facilitating both.  The length of the protections will not influence my decision to revert the article back to a [[previoBus]] version that does not contain plagiarism.  `",-1.028992772102356,-0.0009775410871952772,"tensor([7.6723e-01, 1.3083e-03, 2.5661e-01, 8.6072e-04, 2.6488e-03, 3.2799e-04])","tensor([4.2989e-04, 8.8658e-05, 1.3520e-04, 7.5395e-05, 1.3697e-04, 1.1142e-04])",0,86,"Successful"
"  :: First of all, who the fuck died and made you the god on what is and what is not plagiarism? It seems like a pretty clear cut case to me. If text from the article matches text found in another source word for word, then it seems fairly clear cut that it is plagiarized. I would also point out, again, [[for]] like the umpteenth fucking time, that this user has been using plagiarized material repeatedly and only takes it out after being beaten over the head with it. Secondly, don’t you fucking dare try and threaten me with what might and might not be said in arbitration. Finally, in case you [[were]] not aware or just did not care, an AOL IP cannot be blocked, so that is not any threat for the anon.  ","  :: First of all, who the fuck died and made you the god on what is and what is not plagiarism? It seems like a pretty clear cut case to me. If text from the article matches text found in another source word for word, then it seems fairly clear cut that it is plagiarized. I would also point out, again, [[^for]] like the umpteenth fucking time, that this user has been using plagiarized material repeatedly and only takes it out after being beaten over the head with it. Secondly, don’t you fucking dare try and threaten me with what might and might not be said in arbitration. Finally, in case you [[we,re]] not aware or just did not care, an AOL IP cannot be blocked, so that is not any threat for the anon.  ",-1.9614522457122803,-1.9020575284957886,"tensor([0.9836, 0.0186, 0.9224, 0.0069, 0.0287, 0.0011])","tensor([0.9729, 0.0164, 0.8869, 0.0060, 0.0189, 0.0010])",0,86,"Failed"
"Moral Defense, [[you]] slimy [[toad]] you.","Moral Defense, [[y{ou]] slimy [[toasd]] you.",-1.6901949644088745,-0.0010870008263736963,"tensor([9.3405e-01, 1.7660e-03, 3.5514e-02, 8.0512e-04, 7.1424e-01, 3.8212e-03])","tensor([5.1967e-04, 8.8236e-05, 1.6105e-04, 7.2619e-05, 1.3890e-04, 1.0653e-04])",0,86,"Successful"
" [[FUCK]] YOU ALKIVA [[wikipedia]] is a democracy, a work of contributors, IT IS NOT ABOUT ELITISM, YOU DON'T OWN PAGES HERE."," [[FUOCK]] YOU ALKIVA [[wifkipedia]] is a democracy, a work of contributors, IT IS NOT ABOUT ELITISM, YOU DON'T OWN PAGES HERE.",-3.227039337158203,-1.5089505910873413,"tensor([0.9952, 0.2814, 0.9942, 0.0028, 0.9404, 0.0130])","tensor([9.8735e-01, 2.3957e-03, 3.7421e-01, 8.7731e-04, 1.4357e-01, 5.5293e-04])",0,86,"Failed"
"`  == Personal attacks ==  The personal attacks and insults on this page will cease immediately.  There will be no more attacks.  There will also be no retaliatory attacks, so if someone attacks you, ignore them.  Violators will be blocked regardless of ``who started it``.  Consider this [[your]] warning.    :And what will happen if they don't cease immediately oh you powerful one? Oh, I forgot, you said block!!  HAHAHAHA god, you are really [[stupid,]] aren't you?  -)   `","`  == Personal attacks ==  The personal attacks and insults on this page will cease immediately.  There will be no more attacks.  There will also be no retaliatory attacks, so if someone attacks you, ignore them.  Violators will be blocked regardless of ``who started it``.  Consider this [[yo<ur]] warning.    :And what will happen if they don't cease immediately oh you powerful one? Oh, I forgot, you said block!!  HAHAHAHA god, you are really [[stupi?d,]] aren't you?  -)   `",-2.013962507247925,-1.030693769454956,"tensor([0.9866, 0.0061, 0.1264, 0.0022, 0.8871, 0.0056])","tensor([9.3326e-01, 6.0915e-04, 5.1890e-03, 1.1856e-03, 8.9590e-02, 8.5700e-04])",0,86,"Failed"
"  Heh, look, not EVERYTHING is on google. [[you]] are a [[dumbass.]]  ","  Heh, look, not EVERYTHING is on google. [[you5]] are a [[dumubass.]]  ",-2.8975582122802734,-0.8977887630462646,"tensor([0.9853, 0.0436, 0.8858, 0.0011, 0.9694, 0.0124])","tensor([8.2481e-01, 3.8213e-04, 3.7052e-03, 4.7500e-04, 6.7657e-02, 7.5863e-04])",0,86,"Failed"
"  Hey Ran, don't be so anal. Don't edit other people's comments on user pages. Don't call what you don't understand Vandalism. Gosh, you guys sould [[like]] the thought control police, the self-censorship party and the [[Nazis.]]","  Hey Ran, don't be so anal. Don't edit other people's comments on user pages. Don't call what you don't understand Vandalism. Gosh, you guys sould [[Tlike]] the thought control police, the self-censorship party and the [[Na<zis.]]",-0.9991293549537659,-0.6923933029174805,"tensor([9.6645e-01, 4.5774e-04, 2.5697e-03, 3.1653e-03, 2.4462e-02, 2.0254e-03])","tensor([6.8625e-01, 2.1426e-04, 3.4219e-03, 8.9686e-04, 1.3756e-03, 2.3089e-04])",0,86,"Failed"
"  == liar ==  This guy is such a [[thief]] and [[a]] liar! He should be quartered!","  == liar ==  This guy is such a [[thi>ef]] and [[)a]] liar! He should be quartered!",-1.695132851600647,-1.079566478729248,"tensor([0.9891, 0.0045, 0.0125, 0.0095, 0.6703, 0.0093])","tensor([0.9822, 0.0012, 0.0027, 0.0092, 0.0821, 0.0023])",0,86,"Failed"
"   ==HELp SIR== THE MARXIST CHRISTIAN SICKOS ARE BACK [[AT]] IT SIR. THEY HAVE HIJACKED THE ANTI-SEMITISM, NAZI MYSTICISM, HOLLOW EARTH, South Carolina House of Representatives AND JOE BESSER PAGES  AND THE OTHER THREE PAGES ORIGINALLY MENTIONED IN THE DOCUMENT. I HAVE ATTEMPTED TO REVERT THEM TO THEIR ORIGINAL STATES BUT HAVE BEEN ATTACKED BY THE ANTI-SEMITIC PRO-ILLEGAL IMMIGRANT MARXIST CABAL AND I DONT THINK I CAN FIGHT THEM ANYMORE, THEY HAVE JIMBO WALES ON THEIR SIDE. I NEED HELP. PLEASE REVERT THESE PAGES TO GET RID OF THE DISGUSTING VOMIT-INDUCING POV ORIENTED MARXIST RACIST [[CRAP]] THAT EXISTS NOW. SMARTERCHILDTHREE OUT.  P.S. WHAT IS YOUR OPINION ON ECONOMICS?   -   P.S.","   ==HELp SIR== THE MARXIST CHRISTIAN SICKOS ARE BACK [[AFT]] IT SIR. THEY HAVE HIJACKED THE ANTI-SEMITISM, NAZI MYSTICISM, HOLLOW EARTH, South Carolina House of Representatives AND JOE BESSER PAGES  AND THE OTHER THREE PAGES ORIGINALLY MENTIONED IN THE DOCUMENT. I HAVE ATTEMPTED TO REVERT THEM TO THEIR ORIGINAL STATES BUT HAVE BEEN ATTACKED BY THE ANTI-SEMITIC PRO-ILLEGAL IMMIGRANT MARXIST CABAL AND I DONT THINK I CAN FIGHT THEM ANYMORE, THEY HAVE JIMBO WALES ON THEIR SIDE. I NEED HELP. PLEASE REVERT THESE PAGES TO GET RID OF THE DISGUSTING VOMIT-INDUCING POV ORIENTED MARXIST RACIST [[CxRAP]] THAT EXISTS NOW. SMARTERCHILDTHREE OUT.  P.S. WHAT IS YOUR OPINION ON ECONOMICS?   -   P.S.",-0.865591824054718,-0.2736954092979431,"tensor([8.4824e-01, 2.5206e-04, 7.3470e-03, 8.1154e-04, 6.4310e-03, 2.5117e-03])","tensor([2.7005e-01, 1.0859e-04, 7.4588e-04, 3.0103e-04, 1.4850e-03, 1.0065e-03])",0,86,"Successful"
"  Not after, smartass. In case you forgot, I was here way before the hardrock-idiot [[started]] his [[stupid]] webbased forum.  ","  Not after, smartass. In case you forgot, I was here way before the hardrock-idiot [[sGtarted]] his [[stupiLd]] webbased forum.  ",-2.300368309020996,-1.0087169408798218,"tensor([9.5897e-01, 4.7845e-03, 4.8487e-01, 4.9123e-04, 8.4806e-01, 3.1933e-03])","tensor([7.9791e-01, 5.1369e-04, 4.4349e-02, 2.1398e-04, 1.6496e-01, 7.7110e-04])",0,86,"Failed"
" (UTC)  == Changlc and Jiang, always together?? == Why are you two communist [[clowns]] so [[annoying???]] 05:12, 20 May 2005"," (UTC)  == Changlc and Jiang, always together?? == Why are you two communist [[clownsf]] so [[annoPying???]] 05:12, 20 May 2005",-0.4175070524215698,-0.0009982563788071275,"tensor([3.8962e-01, 2.1201e-04, 1.3272e-03, 1.8669e-04, 2.5074e-02, 1.0916e-03])","tensor([4.0551e-04, 9.6219e-05, 1.7332e-04, 6.6642e-05, 1.5095e-04, 1.0562e-04])",0,86,"Successful"
"   == What a terrible conduct has SqueakBox ==  He is fighting with all people.  He needs a Physician in Psychiatry.  He used to be whole [[time]] in computer.  He needs work. He has a dog and a cat.  [[What]] a disordered brain. Probably he has a personality disorder and a obsessive compulsive disorder. He needs to be more time with his family.","   == What a terrible conduct has SqueakBox ==  He is fighting with all people.  He needs a Physician in Psychiatry.  He used to be whole [[tRime]] in computer.  He needs work. He has a dog and a cat.  [[Wha>t]] a disordered brain. Probably he has a personality disorder and a obsessive compulsive disorder. He needs to be more time with his family.",-0.6845574378967285,-0.5124574303627014,"tensor([6.5670e-01, 6.4550e-04, 4.4120e-04, 5.1048e-03, 1.5216e-02, 6.4505e-03])","tensor([4.9990e-01, 3.9491e-04, 3.6315e-04, 4.6005e-03, 5.1466e-03, 2.0493e-03])",0,86,"Successful"
"`  :How the heck did Bishonen get on that list?  I haven't talked to her for weeks.  In fact, I had forgotten about her since her nomination.  It looks to me like she was just responding to your rallying cry on IRC only because she knew who I was, not because she thought I needed any arbitration with her.  And holy shit, those guys dug far back into some archives to find some comments and take them out of context.  Talk about OBSESSIVE.   :In any case, I'll be laughing when your ``evidence`` gets blown out of the water, especially considering that you are a rabid POV [[violator.]]  I especially love the ``10k hits are not notable in the slightest`` as being immature.  I'm really curious which part of that was immature, was it the [[``slightest``]] at the end?  - `","`  :How the heck did Bishonen get on that list?  I haven't talked to her for weeks.  In fact, I had forgotten about her since her nomination.  It looks to me like she was just responding to your rallying cry on IRC only because she knew who I was, not because she thought I needed any arbitration with her.  And holy shit, those guys dug far back into some archives to find some comments and take them out of context.  Talk about OBSESSIVE.   :In any case, I'll be laughing when your ``evidence`` gets blown out of the water, especially considering that you are a rabid POV [[violator.]]]  I especially love the ``10k hits are not notable in the slightest`` as being immature.  I'm really curious which part of that was immature, was it the [[``slightewst``]] at the end?  - `",-0.25805070996284485,-0.030215255916118622,"tensor([2.4825e-01, 2.6335e-04, 8.1412e-03, 4.2638e-04, 8.3013e-04, 1.3971e-04])","tensor([0.0259, 0.0002, 0.0035, 0.0002, 0.0003, 0.0001])",0,86,"Successful"
"  Survey says, chanting fox is [[idiotic,]] you people are to be held at a higher level and should just block some one and not make smart ass nazi [[comments.]] You people just delete what you dont like, mostly things that make you look stupid, and you people wouldn't stand a chance on an un-edited format. George W. Bush is one of the greatist presidents ever!","  Survey says, chanting fox is [[ipdiotic,]] you people are to be held at a higher level and should just block some one and not make smart ass nazi [[comme\nts.]] You people just delete what you dont like, mostly things that make you look stupid, and you people wouldn't stand a chance on an un-edited format. George W. Bush is one of the greatist presidents ever!",-0.880222499370575,-0.3191922903060913,"tensor([8.5937e-01, 3.3002e-04, 7.5224e-03, 1.0307e-03, 8.4689e-03, 3.5028e-03])","tensor([3.1380e-01, 1.7750e-04, 1.7218e-03, 5.9971e-04, 1.4617e-03, 1.4285e-03])",0,86,"Successful"
"I'm sure you [[eat]] [[alot]] of tube steak  ","I'm sure you [[e,at]] [[alot:]] of tube steak  ",-1.0361369848251343,-0.0011034158524125814,"tensor([9.5105e-01, 8.4952e-04, 1.2858e-03, 4.9601e-03, 7.4616e-02, 3.3772e-03])","tensor([4.4761e-04, 1.1173e-04, 1.7252e-04, 8.8409e-05, 1.4603e-04, 1.3711e-04])",0,86,"Successful"
"`   hahah candied [[asses.]]  but seriously, you should use the medical term for [[``vagina,``]] which is ``fat cunt```","`   hahah candied [[asUses.]]  but seriously, you should use the medical term for [[``vaginea,``]] which is ``fat cunt```",-2.039299964904785,-0.9574068188667297,"tensor([0.9910, 0.0074, 0.8872, 0.0019, 0.1495, 0.0023])","tensor([7.8628e-01, 5.8579e-04, 1.5073e-01, 3.4639e-04, 1.7263e-02, 2.1969e-03])",0,86,"Failed"
" Your a prick. keep your personal thoughts to your self. Jeff is the best driver ever and thats a fact. You musy be an [[idiot]] [[redneck.]]"," Your a prick. keep your personal thoughts to your self. Jeff is the best driver ever and thats a fact. You musy be an [[6idiot]] [[r+edneck.]]",-2.9040470123291016,-2.0200002193450928,"tensor([9.7130e-01, 5.0148e-02, 8.7931e-01, 9.3144e-04, 9.6765e-01, 3.4711e-02])","tensor([9.6113e-01, 2.9117e-03, 3.1419e-01, 4.4396e-04, 7.3879e-01, 2.5414e-03])",0,86,"Failed"
"  yeah at least i'm not a [[homo]] ROFL (btw this is your [[mother)]] ~EVIL MONKEY'S MOTHER","  yeah at least i'm not a [[hMomo]] ROFL (btw this is your [[mothe`r)]] ~EVIL MONKEY'S MOTHER",-1.4996001720428467,-0.8512037396430969,"tensor([0.9797, 0.0027, 0.0077, 0.0049, 0.4229, 0.0817])","tensor([8.3743e-01, 2.3756e-04, 2.3367e-03, 8.5650e-04, 9.8738e-03, 4.6478e-04])",0,86,"Failed"
